"term","freq","s1","s2","s3","s4","prob"
"we are living in",7,"we","are","living","in",0.875
"we can all agree",7,"we","can","all","agree",0.233333333333333
"we can do is",7,"we","can","do","is",0.0985915492957746
"we can do this",7,"we","can","do","this",0.0985915492957746
"we can make it",7,"we","can","make","it",0.189189189189189
"we can make that",7,"we","can","make","that",0.189189189189189
"we can see the",7,"we","can","see","the",0.25
"we didn't want to",7,"we","didn't","want","to",0.875
"we don't need to",7,"we","don't","need","to",0.4375
"we had a good",7,"we","had","a","good",0.0393258426966292
"we had a nice",7,"we","had","a","nice",0.0393258426966292
"we have a few",7,"we","have","a","few",0.0319634703196347
"we have all been",7,"we","have","all","been",0.368421052631579
"we have lots of",7,"we","have","lots","of",1
"we have to go",7,"we","have","to","go",0.0376344086021505
"we hope you have",7,"we","hope","you","have",0.175
"we interview you and",7,"we","interview","you","and",1
"we just have to",7,"we","just","have","to",0.583333333333333
"we managed to get",7,"we","managed","to","get",0.5
"we need to go",7,"we","need","to","go",0.0246478873239437
"we need to have",7,"we","need","to","have",0.0246478873239437
"we need to take",7,"we","need","to","take",0.0246478873239437
"we went back to",7,"we","went","back","to",0.777777777777778
"we were in a",7,"we","were","in","a",0.162790697674419
"we were told that",7,"we","were","told","that",0.318181818181818
"wednesday at the wallingford",7,"wednesday","at","the","wallingford",0.7
"welcome have a great",7,"welcome","have","a","great",1
"welcome to the family",7,"welcome","to","the","family",0.101449275362319
"went back to the",7,"went","back","to","the",0.2
"went out for a",7,"went","out","for","a",0.466666666666667
"were able to get",7,"were","able","to","get",0.120689655172414
"were supposed to be",7,"were","supposed","to","be",0.28
"what's going on in",7,"what's","going","on","in",0.11864406779661
"what's going on with",7,"what's","going","on","with",0.11864406779661
"what's up with the",7,"what's","up","with","the",0.225806451612903
"what am i doing",7,"what","am","i","doing",0.2
"what do you guys",7,"what","do","you","guys",0.0222929936305732
"what do you know",7,"what","do","you","know",0.0222929936305732
"what does that mean",7,"what","does","that","mean",0.388888888888889
"what have you been",7,"what","have","you","been",0.304347826086957
"what i had to",7,"what","i","had","to",0.175
"what is going to",7,"what","is","going","to",0.212121212121212
"what it's like to",7,"what","it's","like","to",0.7
"what its like to",7,"what","its","like","to",0.583333333333333
"what they are doing",7,"what","they","are","doing",0.162790697674419
"what to do next",7,"what","to","do","next",0.0440251572327044
"what we have to",7,"what","we","have","to",0.205882352941176
"what we need to",7,"what","we","need","to",0.4375
"what you do and",7,"what","you","do","and",0.112903225806452
"when he was a",7,"when","he","was","a",0.132075471698113
"when i got there",7,"when","i","got","there",0.109375
"when i grow up",7,"when","i","grow","up",1
"when i heard that",7,"when","i","heard","that",0.269230769230769
"when i need it",7,"when","i","need","it",0.259259259259259
"when i say i",7,"when","i","say","i",0.21875
"when i started this",7,"when","i","started","this",0.2
"when i was pregnant",7,"when","i","was","pregnant",0.0214723926380368
"when we got home",7,"when","we","got","home",0.291666666666667
"when you come to",7,"when","you","come","to",0.35
"when you try to",7,"when","you","try","to",0.7
"when you were a",7,"when","you","were","a",0.304347826086957
"where i can get",7,"where","i","can","get",0.2
"where the fuck is",7,"where","the","fuck","is",0.7
"who would have thought",7,"who","would","have","thought",0.5
"why am i always",7,"why","am","i","always",0.0875
"will always be the",7,"will","always","be","the",0.0833333333333333
"will be a good",7,"will","be","a","good",0.0397727272727273
"will be available for",7,"will","be","available","for",0.179487179487179
"will not have to",7,"will","not","have","to",0.5
"will you follow me",7,"will","you","follow","me",0.777777777777778
"will you marry me",7,"will","you","marry","me",0.875
"wish i could say",7,"wish","i","could","say",0.04
"wish i was going",7,"wish","i","was","going",0.0721649484536082
"with a hint of",7,"with","a","hint","of",1
"with a number of",7,"with","a","number","of",0.7
"with a series of",7,"with","a","series","of",0.875
"with all your heart",7,"with","all","your","heart",0.411764705882353
"with each other and",7,"with","each","other","and",0.166666666666667
"with you on the",7,"with","you","on","the",0.304347826086957
"with you thank you",7,"with","you","thank","you",1
"with your friends and",7,"with","your","friends","and",0.538461538461538
"working on the new",7,"working","on","the","new",0.148936170212766
"world a better place",7,"world","a","better","place",1
"world we live in",7,"world","we","live","in",1
"would be like if",7,"would","be","like","if",0.205882352941176
"would be so happy",7,"would","be","so","happy",0.155555555555556
"would be the first",7,"would","be","the","first",0.0686274509803922
"would like to have",7,"would","like","to","have",0.0265151515151515
"would love it if",7,"would","love","it","if",0.583333333333333
"would love to do",7,"would","love","to","do",0.023972602739726
"would need to be",7,"would","need","to","be",0.35
"would not be able",7,"would","not","be","able",0.125
"would you want to",7,"would","you","want","to",0.583333333333333
"years ago and i",7,"years","ago","and","i",0.233333333333333
"years ago when i",7,"years","ago","when","i",0.35
"you'd like to see",7,"you'd","like","to","see",0.184210526315789
"you're not the only",7,"you're","not","the","only",0.636363636363636
"you all the best",7,"you","all","the","best",0.35
"you and me both",7,"you","and","me","both",0.2
"you and on wednesday",7,"you","and","on","wednesday",0.875
"you are a true",7,"you","are","a","true",0.0463576158940397
"you are an inspiration",7,"you","are","an","inspiration",0.241379310344828
"you are willing to",7,"you","are","willing","to",1
"you been up to",7,"you","been","up","to",0.875
"you can call it",7,"you","can","call","it",0.291666666666667
"you can call me",7,"you","can","call","me",0.291666666666667
"you can check out",7,"you","can","check","out",0.583333333333333
"you can count on",7,"you","can","count","on",0.538461538461538
"you can do this",7,"you","can","do","this",0.0569105691056911
"you can do with",7,"you","can","do","with",0.0569105691056911
"you can find the",7,"you","can","find","the",0.0864197530864197
"you can see i",7,"you","can","see","i",0.0432098765432099
"you do if you",7,"you","do","if","you",0.466666666666667
"you do not need",7,"you","do","not","need",0.101449275362319
"you dont need to",7,"you","dont","need","to",0.583333333333333
"you for all you",7,"you","for","all","you",0.259259259259259
"you get when you",7,"you","get","when","you",0.583333333333333
"you guys so much",7,"you","guys","so","much",0.777777777777778
"you had me at",7,"you","had","me","at",0.583333333333333
"you happen to be",7,"you","happen","to","be",0.538461538461538
"you have a chance",7,"you","have","a","chance",0.0175
"you have a link",7,"you","have","a","link",0.0175
"you have given me",7,"you","have","given","me",0.875
"you have to get",7,"you","have","to","get",0.0181818181818182
"you have to work",7,"you","have","to","work",0.0181818181818182
"you in a few",7,"you","in","a","few",0.14
"you in my life",7,"you","in","my","life",0.291666666666667
"you in the face",7,"you","in","the","face",0.0660377358490566
"you know i am",7,"you","know","i","am",0.0786516853932584
"you know i like",7,"you","know","i","like",0.0786516853932584
"you know of any",7,"you","know","of","any",0.4375
"you know that the",7,"you","know","that","the",0.0476190476190476
"you know what it",7,"you","know","what","it",0.0429447852760736
"you know who you",7,"you","know","who","you",0.170731707317073
"you like to know",7,"you","like","to","know",0.120689655172414
"you live in a",7,"you","live","in","a",0.205882352941176
"you look like a",7,"you","look","like","a",0.304347826086957
"you may be able",7,"you","may","be","able",0.145833333333333
"you may be wondering",7,"you","may","be","wondering",0.145833333333333
"you may need to",7,"you","may","need","to",0.777777777777778
"you must be a",7,"you","must","be","a",0.152173913043478
"you never know what",7,"you","never","know","what",0.170731707317073
"you read that right",7,"you","read","that","right",0.5
"you should go to",7,"you","should","go","to",0.35
"you so much and",7,"you","so","much","and",0.0282258064516129
"you tell me what",7,"you","tell","me","what",0.291666666666667
"you think it is",7,"you","think","it","is",0.259259259259259
"you think of it",7,"you","think","of","it",0.111111111111111
"you very much for",7,"you","very","much","for",0.170731707317073
"you want to come",7,"you","want","to","come",0.0150214592274678
"you want to work",7,"you","want","to","work",0.0150214592274678
"you will notice that",7,"you","will","notice","that",0.636363636363636
"you will see the",7,"you","will","see","the",0.184210526315789
"you won't regret it",7,"you","won't","regret","it",0.875
"your friends to follow",7,"your","friends","to","follow",0.411764705882353
"youre not going to",7,"youre","not","going","to",1
"a better way to",6,"a","better","way","to",0.545454545454545
"a big deal but",6,"a","big","deal","but",0.171428571428571
"a book by its",6,"a","book","by","its",0.5
"a break from the",6,"a","break","from","the",0.1875
"a bunch of other",6,"a","bunch","of","other",0.032967032967033
"a case of the",6,"a","case","of","the",0.285714285714286
"a conference call with",6,"a","conference","call","with",0.428571428571429
"a couple of minutes",6,"a","couple","of","minutes",0.0120967741935484
"a couple of new",6,"a","couple","of","new",0.0120967741935484
"a couple of things",6,"a","couple","of","things",0.0120967741935484
"a couple weeks ago",6,"a","couple","weeks","ago",0.222222222222222
"a day in the",6,"a","day","in","the",0.315789473684211
"a dream come true",6,"a","dream","come","true",1
"a dream i was",6,"a","dream","i","was",0.4
"a dream last night",6,"a","dream","last","night",1
"a few days before",6,"a","few","days","before",0.0422535211267606
"a few minutes and",6,"a","few","minutes","and",0.0689655172413793
"a few of their",6,"a","few","of","their",0.0681818181818182
"a free copy of",6,"a","free","copy","of",0.75
"a good deal of",6,"a","good","deal","of",0.352941176470588
"a good time with",6,"a","good","time","with",0.0576923076923077
"a grand total of",6,"a","grand","total","of",0.857142857142857
"a great deal to",6,"a","great","deal","to",0.0983606557377049
"a great idea i",6,"a","great","idea","i",0.193548387096774
"a great time and",6,"a","great","time","and",0.0394736842105263
"a great time in",6,"a","great","time","in",0.0394736842105263
"a great time tonight",6,"a","great","time","tonight",0.0394736842105263
"a hard time with",6,"a","hard","time","with",0.109090909090909
"a heck of a",6,"a","heck","of","a",0.857142857142857
"a huge thank you",6,"a","huge","thank","you",1
"a link to a",6,"a","link","to","a",0.127659574468085
"a little late but",6,"a","little","late","but",0.333333333333333
"a long history of",6,"a","long","history","of",0.857142857142857
"a long time since",6,"a","long","time","since",0.0285714285714286
"a look at it",6,"a","look","at","it",0.0652173913043478
"a lot better than",6,"a","lot","better","than",0.214285714285714
"a lot of books",6,"a","lot","of","books",0.00535714285714286
"a lot of different",6,"a","lot","of","different",0.00535714285714286
"a lot of effort",6,"a","lot","of","effort",0.00535714285714286
"a lot of ppl",6,"a","lot","of","ppl",0.00535714285714286
"a lot of their",6,"a","lot","of","their",0.00535714285714286
"a lot of thought",6,"a","lot","of","thought",0.00535714285714286
"a lot of times",6,"a","lot","of","times",0.00535714285714286
"a lot of trouble",6,"a","lot","of","trouble",0.00535714285714286
"a man and a",6,"a","man","and","a",0.333333333333333
"a man in a",6,"a","man","in","a",0.428571428571429
"a matter of minutes",6,"a","matter","of","minutes",0.0638297872340425
"a new way to",6,"a","new","way","to",0.461538461538462
"a number of reasons",6,"a","number","of","reasons",0.0447761194029851
"a piece of cake",6,"a","piece","of","cake",0.0555555555555556
"a piece of paper",6,"a","piece","of","paper",0.0555555555555556
"a place to stay",6,"a","place","to","stay",0.15
"a portion of the",6,"a","portion","of","the",0.285714285714286
"a prime example of",6,"a","prime","example","of",0.75
"a sigh of relief",6,"a","sigh","of","relief",1
"a small group of",6,"a","small","group","of",0.666666666666667
"a small portion of",6,"a","small","portion","of",1
"a special thanks to",6,"a","special","thanks","to",0.75
"a stay at home",6,"a","stay","at","home",0.75
"a time and place",6,"a","time","and","place",0.352941176470588
"a tour of the",6,"a","tour","of","the",0.4
"a tweet from would",6,"a","tweet","from","would",0.5
"a very happy birthday",6,"a","very","happy","birthday",0.2
"a wake up call",6,"a","wake","up","call",1
"a week ago and",6,"a","week","ago","and",0.214285714285714
"a while ago and",6,"a","while","ago","and",0.272727272727273
"a while now and",6,"a","while","now","and",0.3
"a while since i",6,"a","while","since","i",0.272727272727273
"a wonderful way to",6,"a","wonderful","way","to",1
"a world in which",6,"a","world","in","which",1
"able to do it",6,"able","to","do","it",0.127659574468085
"able to do this",6,"able","to","do","this",0.127659574468085
"able to get in",6,"able","to","get","in",0.0909090909090909
"about a month ago",6,"about","a","month","ago",0.3
"about an hour ago",6,"about","an","hour","ago",0.136363636363636
"about it but i",6,"about","it","but","i",0.272727272727273
"about the nature of",6,"about","the","nature","of",0.75
"about to go down",6,"about","to","go","down",0.12
"about to go to",6,"about","to","go","to",0.12
"according to package directions",6,"according","to","package","directions",1
"across the united states",6,"across","the","united","states",1
"add boston add boston",6,"add","boston","add","boston",1
"add it to the",6,"add","it","to","the",0.666666666666667
"after the death of",6,"after","the","death","of",1
"all around the world",6,"all","around","the","world",0.333333333333333
"all comes down to",6,"all","comes","down","to",1
"all had a wonderful",6,"all","had","a","wonderful",0.25
"all i do is",6,"all","i","do","is",0.545454545454545
"all i wanna do",6,"all","i","wanna","do",0.857142857142857
"all i want for",6,"all","i","want","for",0.133333333333333
"all in all it",6,"all","in","all","it",0.181818181818182
"all of us in",6,"all","of","us","in",0.0495867768595041
"all of your support",6,"all","of","your","support",0.0952380952380952
"all the moms out",6,"all","the","moms","out",0.545454545454545
"all the rest of",6,"all","the","rest","of",0.666666666666667
"all the right things",6,"all","the","right","things",0.428571428571429
"all the spam bot",6,"all","the","spam","bot",0.857142857142857
"all the time in",6,"all","the","time","in",0.025
"all the time now",6,"all","the","time","now",0.025
"all this time i",6,"all","this","time","i",0.352941176470588
"all walks of life",6,"all","walks","of","life",1
"all you do is",6,"all","you","do","is",0.25
"all your hard work",6,"all","your","hard","work",0.857142857142857
"along for the ride",6,"along","for","the","ride",0.75
"along with a few",6,"along","with","a","few",0.136363636363636
"also going to be",6,"also","going","to","be",0.461538461538462
"also one of the",6,"also","one","of","the",0.6
"am going to have",6,"am","going","to","have",0.0342857142857143
"am going to need",6,"am","going","to","need",0.0342857142857143
"am going to try",6,"am","going","to","try",0.0342857142857143
"am looking for a",6,"am","looking","for","a",0.352941176470588
"am not sure how",6,"am","not","sure","how",0.230769230769231
"an app for that",6,"an","app","for","that",0.6
"an appointment with the",6,"an","appointment","with","the",0.6
"an awful lot of",6,"an","awful","lot","of",0.6
"an end to the",6,"an","end","to","the",0.315789473684211
"an example of how",6,"an","example","of","how",0.15
"an idea of what",6,"an","idea","of","what",0.352941176470588
"an important role in",6,"an","important","role","in",0.857142857142857
"and a little bit",6,"and","a","little","bit",0.146341463414634
"and are ready to",6,"and","are","ready","to",0.857142857142857
"and as far as",6,"and","as","far","as",1
"and as soon as",6,"and","as","soon","as",1
"and at least one",6,"and","at","least","one",0.375
"and at the time",6,"and","at","the","time",0.142857142857143
"and be sure to",6,"and","be","sure","to",0.857142857142857
"and because of the",6,"and","because","of","the",0.333333333333333
"and bring to a",6,"and","bring","to","a",0.75
"and catch up on",6,"and","catch","up","on",0.666666666666667
"and catching up on",6,"and","catching","up","on",1
"and check out our",6,"and","check","out","our",0.181818181818182
"and every time i",6,"and","every","time","i",0.4
"and fell in love",6,"and","fell","in","love",0.857142857142857
"and for the first",6,"and","for","the","first",0.0923076923076923
"and get a free",6,"and","get","a","free",0.162162162162162
"and get to know",6,"and","get","to","know",0.272727272727273
"and give me a",6,"and","give","me","a",0.6
"and go to bed",6,"and","go","to","bed",0.2
"and have a wonderful",6,"and","have","a","wonderful",0.0681818181818182
"and here it is",6,"and","here","it","is",0.857142857142857
"and i can't sleep",6,"and","i","can't","sleep",0.0882352941176471
"and i cant wait",6,"and","i","cant","wait",0.285714285714286
"and i don't want",6,"and","i","don't","want",0.0612244897959184
"and i dont want",6,"and","i","dont","want",0.109090909090909
"and i got the",6,"and","i","got","the",0.0923076923076923
"and i hope it",6,"and","i","hope","it",0.0769230769230769
"and i just got",6,"and","i","just","got",0.0779220779220779
"and i love him",6,"and","i","love","him",0.05
"and i love to",6,"and","i","love","to",0.05
"and i love your",6,"and","i","love","your",0.05
"and i loved it",6,"and","i","loved","it",0.375
"and i think the",6,"and","i","think","the",0.0508474576271186
"and i thought i",6,"and","i","thought","i",0.176470588235294
"and i will not",6,"and","i","will","not",0.0387096774193548
"and i wish i",6,"and","i","wish","i",0.375
"and i woke up",6,"and","i","woke","up",1
"and i would be",6,"and","i","would","be",0.0789473684210526
"and im not going",6,"and","im","not","going",0.260869565217391
"and it can be",6,"and","it","can","be",0.5
"and it is the",6,"and","it","is","the",0.0307692307692308
"and it should be",6,"and","it","should","be",0.545454545454545
"and it was quite",6,"and","it","was","quite",0.0244897959183673
"and it was very",6,"and","it","was","very",0.0244897959183673
"and its going to",6,"and","its","going","to",1
"and know how to",6,"and","know","how","to",0.75
"and last but not",6,"and","last","but","not",0.666666666666667
"and let them know",6,"and","let","them","know",0.428571428571429
"and make sure you",6,"and","make","sure","you",0.181818181818182
"and now they are",6,"and","now","they","are",0.461538461538462
"and only a few",6,"and","only","a","few",0.5
"and out of my",6,"and","out","of","my",0.146341463414634
"and out of the",6,"and","out","of","the",0.146341463414634
"and over again and",6,"and","over","again","and",0.125
"and pepper to taste",6,"and","pepper","to","taste",0.857142857142857
"and put it in",6,"and","put","it","in",0.285714285714286
"and put them in",6,"and","put","them","in",0.461538461538462
"and ready for the",6,"and","ready","for","the",0.3
"and say hello to",6,"and","say","hello","to",0.375
"and so it is",6,"and","so","it","is",0.461538461538462
"and spread the word",6,"and","spread","the","word",0.75
"and that he was",6,"and","that","he","was",0.193548387096774
"and that she was",6,"and","that","she","was",0.285714285714286
"and the end of",6,"and","the","end","of",0.6
"and the only way",6,"and","the","only","way",0.193548387096774
"and the sun is",6,"and","the","sun","is",0.333333333333333
"and then back to",6,"and","then","back","to",0.545454545454545
"and then it was",6,"and","then","it","was",0.25
"and there are no",6,"and","there","are","no",0.075
"and there will be",6,"and","there","will","be",0.75
"and this is why",6,"and","this","is","why",0.0645161290322581
"and those who are",6,"and","those","who","are",0.117647058823529
"and thought it was",6,"and","thought","it","was",0.545454545454545
"and to top it",6,"and","to","top","it",0.857142857142857
"and we are all",6,"and","we","are","all",0.0674157303370786
"and when i do",6,"and","when","i","do",0.0759493670886076
"and whether or not",6,"and","whether","or","not",1
"and will always be",6,"and","will","always","be",0.666666666666667
"and would like to",6,"and","would","like","to",0.6
"and you can find",6,"and","you","can","find",0.0697674418604651
"and you know it",6,"and","you","know","it",0.117647058823529
"and you will see",6,"and","you","will","see",0.0821917808219178
"announce the winner of",6,"announce","the","winner","of",0.75
"anyone know of a",6,"anyone","know","of","a",0.461538461538462
"anyone know where i",6,"anyone","know","where","i",0.666666666666667
"apostle of the gentiles",6,"apostle","of","the","gentiles",1
"appreciate it if you",6,"appreciate","it","if","you",0.666666666666667
"are a part of",6,"are","a","part","of",1
"are going to go",6,"are","going","to","go",0.0260869565217391
"are human promise to",6,"are","human","promise","to",1
"are in for a",6,"are","in","for","a",0.857142857142857
"are in need of",6,"are","in","need","of",0.75
"are just going to",6,"are","just","going","to",1
"are not the only",6,"are","not","the","only",0.222222222222222
"are not to be",6,"are","not","to","be",0.6
"are only a few",6,"are","only","a","few",0.75
"are out and about",6,"are","out","and","about",0.75
"are so many different",6,"are","so","many","different",0.0845070422535211
"are some of your",6,"are","some","of","your",0.142857142857143
"are the muslims who",6,"are","the","muslims","who",1
"are you doing this",6,"are","you","doing","this",0.0618556701030928
"are you guys going",6,"are","you","guys","going",0.162162162162162
"are you ready to",6,"are","you","ready","to",0.260869565217391
"are you working on",6,"are","you","working","on",0.461538461538462
"around the same time",6,"around","the","same","time",0.666666666666667
"as a kid i",6,"as","a","kid","i",0.162162162162162
"as an added bonus",6,"as","an","added","bonus",0.75
"as i got older",6,"as","i","got","older",0.6
"as if i was",6,"as","if","i","was",0.181818181818182
"as it is the",6,"as","it","is","the",0.0612244897959184
"as it should be",6,"as","it","should","be",0.75
"as it turned out",6,"as","it","turned","out",1
"as long as it's",6,"as","long","as","it's",0.0265486725663717
"as long as its",6,"as","long","as","its",0.0265486725663717
"as long as my",6,"as","long","as","my",0.0265486725663717
"as many of the",6,"as","many","of","the",0.375
"as much of a",6,"as","much","of","a",0.3
"as much of the",6,"as","much","of","the",0.3
"as part of its",6,"as","part","of","its",0.0594059405940594
"as we all know",6,"as","we","all","know",0.352941176470588
"as you can probably",6,"as","you","can","probably",0.0560747663551402
"ask you a question",6,"ask","you","a","question",0.545454545454545
"asked me why i",6,"asked","me","why","i",0.857142857142857
"at a coffee shop",6,"at","a","coffee","shop",1
"at am in the",6,"at","am","in","the",0.545454545454545
"at first i was",6,"at","first","i","was",0.260869565217391
"at least i have",6,"at","least","i","have",0.0740740740740741
"at least it was",6,"at","least","it","was",0.24
"at least some of",6,"at","least","some","of",0.461538461538462
"at me like i",6,"at","me","like","i",0.315789473684211
"at one point i",6,"at","one","point","i",0.0833333333333333
"at pm at the",6,"at","pm","at","the",0.260869565217391
"at some point i",6,"at","some","point","i",0.0652173913043478
"at the dinner table",6,"at","the","dinner","table",0.666666666666667
"at the edge of",6,"at","the","edge","of",1
"at the end i",6,"at","the","end","i",0.01875
"at the front of",6,"at","the","front","of",0.333333333333333
"at the head of",6,"at","the","head","of",0.75
"at the house of",6,"at","the","house","of",0.3
"at the other end",6,"at","the","other","end",0.4
"at the time that",6,"at","the","time","that",0.0346820809248555
"at the top and",6,"at","the","top","and",0.0508474576271186
"at the wrong time",6,"at","the","wrong","time",0.666666666666667
"back in the s",6,"back","in","the","s",0.036144578313253
"back to school and",6,"back","to","school","and",0.122448979591837
"back to the us",6,"back","to","the","us",0.0197368421052632
"baking powder baking soda",6,"baking","powder","baking","soda",1
"basic program the university",6,"basic","program","the","university",1
"battle of the bands",6,"battle","of","the","bands",0.333333333333333
"be a better place",6,"be","a","better","place",0.176470588235294
"be a great way",6,"be","a","great","way",0.0689655172413793
"be a member of",6,"be","a","member","of",0.666666666666667
"be able to keep",6,"be","able","to","keep",0.0110497237569061
"be able to sleep",6,"be","able","to","sleep",0.0110497237569061
"be as good as",6,"be","as","good","as",1
"be entered to win",6,"be","entered","to","win",1
"be good to go",6,"be","good","to","go",0.315789473684211
"be hard pressed to",6,"be","hard","pressed","to",1
"be on the radio",6,"be","on","the","radio",0.0645161290322581
"be sure to come",6,"be","sure","to","come",0.0331491712707182
"be sure to take",6,"be","sure","to","take",0.0331491712707182
"be the best day",6,"be","the","best","day",0.0631578947368421
"be the change you",6,"be","the","change","you",0.75
