"term","freq","s1","s2","s3","s4","prob"
"to do some work",5,"to","do","some","work",0.25
"to do this i",5,"to","do","this","i",0.192307692307692
"to do with my",5,"to","do","with","my",0.0666666666666667
"to figure out what",5,"to","figure","out","what",0.151515151515152
"to find out what",5,"to","find","out","what",0.161290322580645
"to give it to",5,"to","give","it","to",0.294117647058824
"to go to a",5,"to","go","to","a",0.0510204081632653
"to go with the",5,"to","go","with","the",0.263157894736842
"to hang out with",5,"to","hang","out","with",0.384615384615385
"to head back to",5,"to","head","back","to",1
"to hear from you",5,"to","hear","from","you",0.454545454545455
"to hear what you",5,"to","hear","what","you",0.5
"to one of the",5,"to","one","of","the",0.227272727272727
"to our new followers",5,"to","our","new","followers",0.833333333333333
"to pick it up",5,"to","pick","it","up",1
"to pick up a",5,"to","pick","up","a",0.25
"to say the same",5,"to","say","the","same",0.277777777777778
"to see you all",5,"to","see","you","all",0.0490196078431373
"to talk to you",5,"to","talk","to","you",0.125
"to tell you what",5,"to","tell","you","what",0.151515151515152
"to the front of",5,"to","the","front","of",0.333333333333333
"to the grocery store",5,"to","the","grocery","store",0.833333333333333
"to the point of",5,"to","the","point","of",0.227272727272727
"to the top of",5,"to","the","top","of",0.555555555555556
"to the united states",5,"to","the","united","states",0.714285714285714
"today is the day",5,"today","is","the","day",0.3125
"used to be a",5,"used","to","be","a",0.161290322580645
"wait to see what",5,"wait","to","see","what",0.0909090909090909
"want to be the",5,"want","to","be","the",0.0641025641025641
"want to do is",5,"want","to","do","is",0.135135135135135
"want to know how",5,"want","to","know","how",0.138888888888889
"want to make sure",5,"want","to","make","sure",0.277777777777778
"want you to be",5,"want","you","to","be",0.192307692307692
"was a bit of",5,"was","a","bit","of",0.3125
"was a good idea",5,"was","a","good","idea",0.151515151515152
"we are at the",5,"we","are","at","the",0.833333333333333
"we are going to",5,"we","are","going","to",0.555555555555556
"we are in the",5,"we","are","in","the",0.416666666666667
"we can do it",5,"we","can","do","it",0.277777777777778
"we just need to",5,"we","just","need","to",0.833333333333333
"we need to get",5,"we","need","to","get",0.0746268656716418
"we want to be",5,"we","want","to","be",0.151515151515152
"we were going to",5,"we","were","going","to",0.833333333333333
"we were in the",5,"we","were","in","the",0.384615384615385
"week and a half",5,"week","and","a","half",0.833333333333333
"what a great way",5,"what","a","great","way",0.217391304347826
"what are you up",5,"what","are","you","up",0.102040816326531
"what does this mean",5,"what","does","this","mean",0.833333333333333
"what is up with",5,"what","is","up","with",0.833333333333333
"what would you do",5,"what","would","you","do",0.384615384615385
"when i get back",5,"when","i","get","back",0.208333333333333
"when i get home",5,"when","i","get","home",0.208333333333333
"when i look at",5,"when","i","look","at",0.833333333333333
"when i was pregnant",5,"when","i","was","pregnant",0.0510204081632653
"who is going to",5,"who","is","going","to",1
"will be at the",5,"will","be","at","the",0.333333333333333
"will let you know",5,"will","let","you","know",0.625
"with a couple of",5,"with","a","couple","of",0.625
"with a lot of",5,"with","a","lot","of",0.833333333333333
"with all of the",5,"with","all","of","the",0.384615384615385
"with one of my",5,"with","one","of","my",0.384615384615385
"with some of the",5,"with","some","of","the",0.416666666666667
"woke up this morning",5,"woke","up","this","morning",1
"would love to chat",5,"would","love","to","chat",0.0617283950617284
"would mean the world",5,"would","mean","the","world",1
"you all had a",5,"you","all","had","a",1
"you are having a",5,"you","are","having","a",0.833333333333333
"you are looking for",5,"you","are","looking","for",0.833333333333333
"you can go to",5,"you","can","go","to",0.714285714285714
"you going to be",5,"you","going","to","be",0.166666666666667
"you have a good",5,"you","have","a","good",0.0531914893617021
"you know i have",5,"you","know","i","have",0.172413793103448
"you know i love",5,"you","know","i","love",0.172413793103448
"you might as well",5,"you","might","as","well",1
"you might want to",5,"you","might","want","to",1
"you need to get",5,"you","need","to","get",0.0714285714285714
"you to all the",5,"you","to","all","the",0.384615384615385
"you to everyone who",5,"you","to","everyone","who",0.5
"you want to see",5,"you","want","to","see",0.05
"you will be missed",5,"you","will","be","missed",0.116279069767442
