"term","freq","s1","s2","s3","s4","prob"
"the back of your",10,"the","back","of","your",0.0649350649350649
"the beauty of the",10,"the","beauty","of","the",0.277777777777778
"the case of the",10,"the","case","of","the",0.256410256410256
"the cause of the",10,"the","cause","of","the",0.32258064516129
"the crap out of",10,"the","crap","out","of",1
"the eyes of the",10,"the","eyes","of","the",0.3125
"the fairmont hotel in",10,"the","fairmont","hotel","in",1
"the first time i've",10,"the","first","time","i've",0.0261096605744125
"the girl with the",10,"the","girl","with","the",0.909090909090909
"the home of the",10,"the","home","of","the",0.5
"the idea of the",10,"the","idea","of","the",0.0684931506849315
"the list goes on",10,"the","list","goes","on",1
"the need for a",10,"the","need","for","a",0.27027027027027
"the next day and",10,"the","next","day","and",0.099009900990099
"the next few months",10,"the","next","few","months",0.178571428571429
"the next time you",10,"the","next","time","you",0.263157894736842
"the north dakota home",10,"the","north","dakota","home",0.5
"the only one i",10,"the","only","one","i",0.062111801242236
"the only time i",10,"the","only","time","i",0.344827586206897
"the people who are",10,"the","people","who","are",0.0862068965517241
"the possibilities are endless",10,"the","possibilities","are","endless",0.833333333333333
"the reason why i",10,"the","reason","why","i",0.277777777777778
"the rest of our",10,"the","rest","of","our",0.01953125
"the right thing to",10,"the","right","thing","to",0.208333333333333
"the sake of the",10,"the","sake","of","the",0.263157894736842
"the same thing as",10,"the","same","thing","as",0.0675675675675676
"the same way that",10,"the","same","way","that",0.0952380952380952
"the story of a",10,"the","story","of","a",0.114942528735632
"the th anniversary of",10,"the","th","anniversary","of",0.769230769230769
"the united states the",10,"the","united","states","the",0.0497512437810945
"the way it is",10,"the","way","it","is",0.2
"the work of the",10,"the","work","of","the",0.212765957446809
"the world is a",10,"the","world","is","a",0.105263157894737
"the year of the",10,"the","year","of","the",0.588235294117647
"then there was the",10,"then","there","was","the",0.5
"there is a good",10,"there","is","a","good",0.0215982721382289
"there is no one",10,"there","is","no","one",0.028169014084507
"there needs to be",10,"there","needs","to","be",1
"there was also a",10,"there","was","also","a",0.625
"there was only one",10,"there","was","only","one",0.625
"theres a lot of",10,"theres","a","lot","of",0.833333333333333
"they are looking for",10,"they","are","looking","for",0.625
"they dont want to",10,"they","dont","want","to",0.666666666666667
"they need to be",10,"they","need","to","be",0.166666666666667
"think a lot of",10,"think","a","lot","of",0.769230769230769
"think i may have",10,"think","i","may","have",0.555555555555556
"this all the time",10,"this","all","the","time",0.769230769230769
"this is the last",10,"this","is","the","last",0.0252525252525253
"this was the first",10,"this","was","the","first",0.135135135135135
"thought it was just",10,"thought","it","was","just",0.072463768115942
"time of with nike",10,"time","of","with","nike",1
"tips on how to",10,"tips","on","how","to",0.833333333333333
"to add to my",10,"to","add","to","my",0.208333333333333
"to be the first",10,"to","be","the","first",0.033112582781457
"to be the one",10,"to","be","the","one",0.033112582781457
"to be there for",10,"to","be","there","for",0.140845070422535
"to call it a",10,"to","call","it","a",0.294117647058824
"to check out our",10,"to","check","out","our",0.0840336134453782
"to come in and",10,"to","come","in","and",0.285714285714286
"to connect with you",10,"to","connect","with","you",0.25
"to deal with a",10,"to","deal","with","a",0.0763358778625954
"to do to get",10,"to","do","to","get",0.232558139534884
"to get on the",10,"to","get","on","the",0.2
"to get you to",10,"to","get","you","to",0.24390243902439
"to give you an",10,"to","give","you","an",0.15625
"to go with it",10,"to","go","with","it",0.135135135135135
"to hear what you",10,"to","hear","what","you",0.357142857142857
"to keep an eye",10,"to","keep","an","eye",0.714285714285714
"to know about the",10,"to","know","about","the",0.256410256410256
"to make sure you",10,"to","make","sure","you",0.0675675675675676
"to meet you at",10,"to","meet","you","at",0.0769230769230769
"to name a few",10,"to","name","a","few",0.625
"to participate in the",10,"to","participate","in","the",0.32258064516129
"to pick me up",10,"to","pick","me","up",1
"to point out that",10,"to","point","out","that",0.526315789473684
"to see if they",10,"to","see","if","they",0.0826446280991736
"to see more of",10,"to","see","more","of",0.333333333333333
"to see so many",10,"to","see","so","many",1
"to set up a",10,"to","set","up","a",0.238095238095238
"to stay on the",10,"to","stay","on","the",0.416666666666667
"to take a break",10,"to","take","a","break",0.0526315789473684
"to take a few",10,"to","take","a","few",0.0526315789473684
"to take a look",10,"to","take","a","look",0.0526315789473684
"to take part in",10,"to","take","part","in",0.769230769230769
"to tell the truth",10,"to","tell","the","truth",0.384615384615385
"to the idea of",10,"to","the","idea","of",0.476190476190476
"to those of you",10,"to","those","of","you",0.434782608695652
"to those who have",10,"to","those","who","have",0.142857142857143
"to try and get",10,"to","try","and","get",0.119047619047619
"to try it out",10,"to","try","it","out",0.256410256410256
"to wake up and",10,"to","wake","up","and",0.169491525423729
"to work with you",10,"to","work","with","you",0.104166666666667
"today was a good",10,"today","was","a","good",0.384615384615385
"trying to get my",10,"trying","to","get","my",0.0617283950617284
"wait for the next",10,"wait","for","the","next",0.105263157894737
"wait to see them",10,"wait","to","see","them",0.04149377593361
"wake up in the",10,"wake","up","in","the",0.833333333333333
"want to be like",10,"want","to","be","like",0.0341296928327645
"want to do a",10,"want","to","do","a",0.0806451612903226
"want to do it",10,"want","to","do","it",0.0806451612903226
"want to see a",10,"want","to","see","a",0.0675675675675676
"want to see it",10,"want","to","see","it",0.0675675675675676
"want to see you",10,"want","to","see","you",0.0675675675675676
"was a bit of",10,"was","a","bit","of",0.147058823529412
"was born in the",10,"was","born","in","the",0.185185185185185
"was kind enough to",10,"was","kind","enough","to",1
"was not going to",10,"was","not","going","to",0.909090909090909
"we are at the",10,"we","are","at","the",0.434782608695652
"we can do it",10,"we","can","do","it",0.140845070422535
"we talked about the",10,"we","talked","about","the",0.285714285714286
"were a lot of",10,"were","a","lot","of",0.714285714285714
"what does this mean",10,"what","does","this","mean",0.666666666666667
"what i love about",10,"what","i","love","about",0.526315789473684
"what i was thinking",10,"what","i","was","thinking",0.113636363636364
"what it is i",10,"what","it","is","i",0.0909090909090909
"what it looks like",10,"what","it","looks","like",1
"what it takes to",10,"what","it","takes","to",0.769230769230769
"what it would be",10,"what","it","would","be",0.588235294117647
"when i think about",10,"when","i","think","about",0.3125
"when i try to",10,"when","i","try","to",0.833333333333333
"when i was growing",10,"when","i","was","growing",0.0306748466257669
"when i was young",10,"when","i","was","young",0.0306748466257669
"when i woke up",10,"when","i","woke","up",1
"when she was a",10,"when","she","was","a",0.158730158730159
"where will you be",10,"where","will","you","be",0.909090909090909
"where you want to",10,"where","you","want","to",0.666666666666667
"which i think is",10,"which","i","think","is",0.476190476190476
"will have to be",10,"will","have","to","be",0.0699300699300699
"with a bit of",10,"with","a","bit","of",0.625
"with all of you",10,"with","all","of","you",0.181818181818182
"wont be able to",10,"wont","be","able","to",1
"world would be a",10,"world","would","be","a",0.769230769230769
"would be nice to",10,"would","be","nice","to",0.303030303030303
"would be the perfect",10,"would","be","the","perfect",0.0980392156862745
"would like to talk",10,"would","like","to","talk",0.0378787878787879
"would love to know",10,"would","love","to","know",0.0342465753424658
"would mean the world",10,"would","mean","the","world",0.909090909090909
"yes yes yes yes",10,"yes","yes","yes","yes",0.333333333333333
"you are not a",10,"you","are","not","a",0.106382978723404
"you are very welcome",10,"you","are","very","welcome",0.303030303030303
"you dont know what",10,"you","dont","know","what",0.294117647058824
"you follow me please",10,"you","follow","me","please",0.149253731343284
"you get a chance",10,"you","get","a","chance",0.125
"you had a wonderful",10,"you","had","a","wonderful",0.0943396226415094
"you have an amazing",10,"you","have","an","amazing",0.188679245283019
"you know i love",10,"you","know","i","love",0.112359550561798
"you know you can",10,"you","know","you","can",0.149253731343284
"you may have noticed",10,"you","may","have","noticed",0.163934426229508
"you never know when",10,"you","never","know","when",0.24390243902439
"you thank you thank",10,"you","thank","you","thank",0.196078431372549
"you think about it",10,"you","think","about","it",0.232558139534884
"you want to talk",10,"you","want","to","talk",0.0214592274678112
"a bit of the",9,"a","bit","of","the",0.0310344827586207
"a few days later",9,"a","few","days","later",0.0633802816901408
"a few minutes later",9,"a","few","minutes","later",0.103448275862069
"a great day today",9,"a","great","day","today",0.0418604651162791
"a great weekend and",9,"a","great","weekend","and",0.0616438356164384
"a link to your",9,"a","link","to","your",0.191489361702128
"a long time but",9,"a","long","time","but",0.0428571428571429
"a long way to",9,"a","long","way","to",0.163636363636364
"a lot more than",9,"a","lot","more","than",0.09
"a lot of it",9,"a","lot","of","it",0.00803571428571428
"a lot of that",9,"a","lot","of","that",0.00803571428571428
"a minute or two",9,"a","minute","or","two",0.75
"a month or so",9,"a","month","or","so",0.6
"a pain in the",9,"a","pain","in","the",0.9
"a part of my",9,"a","part","of","my",0.0520231213872832
"a safe and happy",9,"a","safe","and","happy",0.346153846153846
"a visit to the",9,"a","visit","to","the",0.428571428571429
"a way that is",9,"a","way","that","is",0.160714285714286
"a week and a",9,"a","week","and","a",0.25
"a year and a",9,"a","year","and","a",0.346153846153846
"about the size of",9,"about","the","size","of",1
"about to take a",9,"about","to","take","a",0.5625
"account has been hacked",9,"account","has","been","hacked",1
"advice on how to",9,"advice","on","how","to",1
"after all these years",9,"after","all","these","years",0.818181818181818
"all i can think",9,"all","i","can","think",0.152542372881356
"all is well with",9,"all","is","well","with",0.155172413793103
"all of us to",9,"all","of","us","to",0.0743801652892562
"all the hard work",9,"all","the","hard","work",0.9
"all the things i",9,"all","the","things","i",0.243243243243243
"am happy to say",9,"am","happy","to","say",0.391304347826087
"am really looking forward",9,"am","really","looking","forward",1
"an integral part of",9,"an","integral","part","of",1
"and at the same",9,"and","at","the","same",0.214285714285714
"and every one of",9,"and","every","one","of",0.75
"and i'll tell you",9,"and","i'll","tell","you",1
"and i am still",9,"and","i","am","still",0.0378151260504202
"and i had no",9,"and","i","had","no",0.0857142857142857
"and i took a",9,"and","i","took","a",0.409090909090909
"and if you want",9,"and","if","you","want",0.0803571428571429
"and it's not even",9,"and","it's","not","even",0.290322580645161
"and it has been",9,"and","it","has","been",0.25
"and it made me",9,"and","it","made","me",0.818181818181818
"and look at the",9,"and","look","at","the",0.310344827586207
"and looking forward to",9,"and","looking","forward","to",1
"and make sure to",9,"and","make","sure","to",0.272727272727273
"and of course the",9,"and","of","course","the",0.072
"and on the other",9,"and","on","the","other",0.147540983606557
"and on top of",9,"and","on","top","of",0.9
"and that is a",9,"and","that","is","a",0.0947368421052632
"and then there are",9,"and","then","there","are",0.346153846153846
"and this is crazy",9,"and","this","is","crazy",0.0967741935483871
"and we have to",9,"and","we","have","to",0.163636363636364
"and will continue to",9,"and","will","continue","to",0.818181818181818
"any of the other",9,"any","of","the","other",0.0957446808510638
"anyone know how to",9,"anyone","know","how","to",0.818181818181818
"anyone who wants to",9,"anyone","who","wants","to",1
"anywhere in the world",9,"anywhere","in","the","world",0.5
"are you ready for",9,"are","you","ready","for",0.391304347826087
"are you waiting for",9,"are","you","waiting","for",1
"around the corner from",9,"around","the","corner","from",0.157894736842105
"as a member of",9,"as","a","member","of",0.818181818181818
"as i can remember",9,"as","i","can","remember",0.116883116883117
"as if it was",9,"as","if","it","was",0.272727272727273
"as long as it",9,"as","long","as","it",0.0398230088495575
"as much a part",9,"as","much","a","part",0.692307692307692
"as soon as they",9,"as","soon","as","they",0.0491803278688525
"as we know it",9,"as","we","know","it",0.529411764705882
"at the corner of",9,"at","the","corner","of",1
"at the moment and",9,"at","the","moment","and",0.0714285714285714
"at the white house",9,"at","the","white","house",0.75
"at this time of",9,"at","this","time","of",0.163636363636364
"awkward moment when you're",9,"awkward","moment","when","you're",0.0989010989010989
"back in the studio",9,"back","in","the","studio",0.0542168674698795
"be a better person",9,"be","a","better","person",0.264705882352941
"be a good thing",9,"be","a","good","thing",0.0538922155688623
"be able to have",9,"be","able","to","have",0.0165745856353591
"be able to play",9,"be","able","to","play",0.0165745856353591
"be able to take",9,"be","able","to","take",0.0165745856353591
"be one of my",9,"be","one","of","my",0.123287671232877
"be sure to follow",9,"be","sure","to","follow",0.0497237569060773
"be sure to stop",9,"be","sure","to","stop",0.0497237569060773
"be the death of",9,"be","the","death","of",1
"be the same as",9,"be","the","same","as",0.173076923076923
"because i had a",9,"because","i","had","a",0.333333333333333
"because i have a",9,"because","i","have","a",0.169811320754717
"because it was the",9,"because","it","was","the",0.118421052631579
"become a part of",9,"become","a","part","of",1
"been trying to get",9,"been","trying","to","get",0.225
"being a part of",9,"being","a","part","of",0.9
"but i am still",9,"but","i","am","still",0.0629370629370629
"but i do have",9,"but","i","do","have",0.121621621621622
"but i think its",9,"but","i","think","its",0.0491803278688525
"but i think the",9,"but","i","think","the",0.0491803278688525
"but i will be",9,"but","i","will","be",0.142857142857143
"but if you do",9,"but","if","you","do",0.0891089108910891
"but im not sure",9,"but","im","not","sure",0.321428571428571
"but in this case",9,"but","in","this","case",0.428571428571429
"but it was fun",9,"but","it","was","fun",0.0535714285714286
"but that is not",9,"but","that","is","not",0.209302325581395
"but the fact that",9,"but","the","fact","that",0.529411764705882
"cabin in the woods",9,"cabin","in","the","woods",0.9
"can be found here",9,"can","be","found","here",0.195652173913043
"can be found in",9,"can","be","found","in",0.195652173913043
"can you help me",9,"can","you","help","me",0.6
"can you tell me",9,"can","you","tell","me",0.391304347826087
"cant wait to go",9,"cant","wait","to","go",0.128571428571429
"check out our website",9,"check","out","our","website",0.0978260869565217
"close your eyes and",9,"close","your","eyes","and",0.529411764705882
"come see us at",9,"come","see","us","at",0.321428571428571
"come to terms with",9,"come","to","terms","with",0.9
"congrats on the new",9,"congrats","on","the","new",0.176470588235294
"could have been a",9,"could","have","been","a",0.140625
"cup of tea and",9,"cup","of","tea","and",0.36
"day at the office",9,"day","at","the","office",0.191489361702128
"day of the year",9,"day","of","the","year",0.108433734939759
"decided to have a",9,"decided","to","have","a",0.692307692307692
"difficult for me to",9,"difficult","for","me","to",0.75
"do what i do",9,"do","what","i","do",0.3
"do you do when",9,"do","you","do","when",0.1875
"do you feel about",9,"do","you","feel","about",0.333333333333333
"do you get to",9,"do","you","get","to",0.230769230769231
"do you know the",9,"do","you","know","the",0.0526315789473684
"do you know when",9,"do","you","know","when",0.0526315789473684
"do you know where",9,"do","you","know","where",0.0526315789473684
"do you know who",9,"do","you","know","who",0.0526315789473684
"do you think it",9,"do","you","think","it",0.0330882352941176
"do you think they",9,"do","you","think","they",0.0330882352941176
"does not seem to",9,"does","not","seem","to",0.75
"doesn't know how to",9,"doesn't","know","how","to",0.642857142857143
"doing a great job",9,"doing","a","great","job",0.818181818181818
"doing the right thing",9,"doing","the","right","thing",0.9
"don't know how i",9,"don't","know","how","i",0.1
"don't know how much",9,"don't","know","how","much",0.1
"don't know if it",9,"don't","know","if","it",0.118421052631579
"don't think i can",9,"don't","think","i","can",0.219512195121951
"don't want to know",9,"don't","want","to","know",0.0407239819004525
"don't want to miss",9,"don't","want","to","miss",0.0407239819004525
"don't want you to",9,"don't","want","you","to",0.642857142857143
"dont know how to",9,"dont","know","how","to",0.264705882352941
"end of the spectrum",9,"end","of","the","spectrum",0.0245901639344262
"enter to win a",9,"enter","to","win","a",0.6
"even if you dont",9,"even","if","you","dont",0.145161290322581
"even though i have",9,"even","though","i","have",0.107142857142857
"even though i was",9,"even","though","i","was",0.107142857142857
"even though it was",9,"even","though","it","was",0.225
"every now and again",9,"every","now","and","again",0.236842105263158
"face to face with",9,"face","to","face","with",0.272727272727273
"favorite thing to do",9,"favorite","thing","to","do",0.818181818181818
"feeling you get when",9,"feeling","you","get","when",0.818181818181818
"figure out what to",9,"figure","out","what","to",0.219512195121951
"follow looking forward to",9,"follow","looking","forward","to",1
"following me on twitter",9,"following","me","on","twitter",0.6
"for a total of",9,"for","a","total","of",0.818181818181818
"for a very long",9,"for","a","very","long",0.45
"for all the support",9,"for","all","the","support",0.0656934306569343
"for all your support",9,"for","all","your","support",0.195652173913043
"for just a few",9,"for","just","a","few",0.5
"for me in the",9,"for","me","in","the",0.3
"for me to do",9,"for","me","to","do",0.038135593220339
"for minutes or until",9,"for","minutes","or","until",0.9
"for more than a",9,"for","more","than","a",0.173076923076923
"for some of the",9,"for","some","of","the",0.391304347826087
"for the future of",9,"for","the","future","of",0.243243243243243
"for the next two",9,"for","the","next","two",0.0566037735849057
"for the next years",9,"for","the","next","years",0.0566037735849057
"for the people who",9,"for","the","people","who",0.290322580645161
"for those who dont",9,"for","those","who","dont",0.0947368421052632
"for you if you",9,"for","you","if","you",0.642857142857143
"for your chance to",9,"for","your","chance","to",0.692307692307692
"forward to catching up",9,"forward","to","catching","up",1
"forward to the next",9,"forward","to","the","next",0.104651162790698
"forward to working with",9,"forward","to","working","with",0.529411764705882
"from here on out",9,"from","here","on","out",0.818181818181818
"from the other side",9,"from","the","other","side",0.346153846153846
"from the rest of",9,"from","the","rest","of",0.818181818181818
"get a lot of",9,"get","a","lot","of",0.692307692307692
"get away with it",9,"get","away","with","it",0.333333333333333
"get back into the",9,"get","back","into","the",0.428571428571429
"get in touch with",9,"get","in","touch","with",0.391304347826087
"get the chance to",9,"get","the","chance","to",0.692307692307692
"get to see the",9,"get","to","see","the",0.142857142857143
"getting out of the",9,"getting","out","of","the",0.409090909090909
"girl with the dragon",9,"girl","with","the","dragon",0.692307692307692
"give a shout out",9,"give","a","shout","out",0.818181818181818
"given the opportunity to",9,"given","the","opportunity","to",0.9
"glad to see you",9,"glad","to","see","you",0.230769230769231
"go a long way",9,"go","a","long","way",0.9
"go to the gym",9,"go","to","the","gym",0.0384615384615385
"goes on and on",9,"goes","on","and","on",0.9
"going to be about",9,"going","to","be","about",0.0120643431635389
"going to do a",9,"going","to","do","a",0.0756302521008403
"going to give you",9,"going","to","give","you",0.3
"going to look like",9,"going","to","look","like",0.45
"going to miss you",9,"going","to","miss","you",0.28125
"got a call from",9,"got","a","call","from",0.818181818181818
"got the best of",9,"got","the","best","of",0.642857142857143
"great way to end",9,"great","way","to","end",0.109756097560976
"grew up in the",9,"grew","up","in","the",0.230769230769231
"happy birthday to me",9,"happy","birthday","to","me",0.0692307692307692
"happy st patrick's day",9,"happy","st","patrick's","day",0.9
"hard it is to",9,"hard","it","is","to",0.9
"have a blessed day",9,"have","a","blessed","day",0.409090909090909
"have a good night",9,"have","a","good","night",0.0569620253164557
"have a nice day",9,"have","a","nice","day",0.236842105263158
"have been a little",9,"have","been","a","little",0.0891089108910891
"have been on the",9,"have","been","on","the",0.36
"have been trying to",9,"have","been","trying","to",0.818181818181818
"have been working on",9,"have","been","working","on",0.45
"have so much to",9,"have","so","much","to",0.209302325581395
"have the courage to",9,"have","the","courage","to",0.9
"have to be a",9,"have","to","be","a",0.0424528301886792
"have to get the",9,"have","to","get","the",0.09375
"have to make sure",9,"have","to","make","sure",0.152542372881356
"have to see it",9,"have","to","see","it",0.25
"have to take the",9,"have","to","take","the",0.134328358208955
"have you been to",9,"have","you","been","to",0.109756097560976
"have you ever seen",9,"have","you","ever","seen",0.108433734939759
"haven't been on twitter",9,"haven't","been","on","twitter",0.391304347826087
"he is not a",9,"he","is","not","a",0.169811320754717
"he told me that",9,"he","told","me","that",0.1875
"he told me to",9,"he","told","me","to",0.1875
"he was one of",9,"he","was","one","of",0.818181818181818
"he was trying to",9,"he","was","trying","to",1
"he would have been",9,"he","would","have","been",0.230769230769231
"head over to the",9,"head","over","to","the",0.473684210526316
"help us spread the",9,"help","us","spread","the",1
"here we go again",9,"here","we","go","again",0.183673469387755
"home from the hospital",9,"home","from","the","hospital",0.36
"hope you all have",9,"hope","you","all","have",0.214285714285714
"hope you have an",9,"hope","you","have","an",0.0857142857142857
"how did i miss",9,"how","did","i","miss",0.264705882352941
"how old r u",9,"how","old","r","u",1
"i'm a sucker for",9,"i'm","a","sucker","for",1
"i'm about to go",9,"i'm","about","to","go",0.183673469387755
"i'm not sure what",9,"i'm","not","sure","what",0.0782608695652174
"i'm ready to go",9,"i'm","ready","to","go",0.272727272727273
"i've always wanted to",9,"i've","always","wanted","to",0.642857142857143
"i am at the",9,"i","am","at","the",0.264705882352941
"i am still in",9,"i","am","still","in",0.0947368421052632
"i am supposed to",9,"i","am","supposed","to",1
"i am sure that",9,"i","am","sure","that",0.136363636363636
"i am sure you",9,"i","am","sure","you",0.136363636363636
"i am thinking about",9,"i","am","thinking","about",0.3
"i beg to differ",9,"i","beg","to","differ",0.9
"i came across a",9,"i","came","across","a",0.264705882352941
"i can't believe it's",9,"i","can't","believe","it's",0.079646017699115
"i can guarantee you",9,"i","can","guarantee","you",0.692307692307692
"i cant help but",9,"i","cant","help","but",0.6
"i decided to do",9,"i","decided","to","do",0.0398230088495575
"i do not like",9,"i","do","not","like",0.0535714285714286
"i do what i",9,"i","do","what","i",0.818181818181818
"i don't know but",9,"i","don't","know","but",0.0217391304347826
"i don't know where",9,"i","don't","know","where",0.0217391304347826
"i don't really know",9,"i","don't","really","know",0.257142857142857
"i don't think he",9,"i","don't","think","he",0.0376569037656904
"i don't want you",9,"i","don't","want","you",0.0535714285714286
"i get to go",9,"i","get","to","go",0.0818181818181818
"i go to sleep",9,"i","go","to","sleep",0.128571428571429
"i go to the",9,"i","go","to","the",0.128571428571429
"i got a new",9,"i","got","a","new",0.0542168674698795
"i guess this is",9,"i","guess","this","is",0.6
"i had a few",9,"i","had","a","few",0.0244565217391304
"i had in my",9,"i","had","in","my",0.5
"i have been a",9,"i","have","been","a",0.0247252747252747
"i have found that",9,"i","have","found","that",0.272727272727273
"i have my own",9,"i","have","my","own",0.225
"i have nothing to",9,"i","have","nothing","to",0.36
"i have seen in",9,"i","have","seen","in",0.195652173913043
"i have something to",9,"i","have","something","to",0.5
"i have such a",9,"i","have","such","a",0.6
"i have to keep",9,"i","have","to","keep",0.0160427807486631
