"term","freq","s1","s2","s3","s4","prob"
"thanks for the follow",350,"thanks","for","the","follow",0.24822695035461
"the end of the",304,"the","end","of","the",0.507512520868113
"the rest of the",291,"the","rest","of","the",0.568359375
"at the end of",257,"at","the","end","of",0.803125
"for the first time",219,"for","the","first","time",0.787769784172662
"can't wait to see",197,"can't","wait","to","see",0.387795275590551
"thanks for the rt",195,"thanks","for","the","rt",0.138297872340426
"is going to be",193,"is","going","to","be",0.435665914221219
"is one of the",189,"is","one","of","the",0.517808219178082
"thank you for the",188,"thank","you","for","the",0.320272572402044
"if you want to",181,"if","you","want","to",0.580128205128205
"thank you so much",180,"thank","you","so","much",0.9375
"at the same time",175,"at","the","same","time",0.849514563106796
"in the middle of",171,"in","the","middle","of",0.733905579399142
"when it comes to",170,"when","it","comes","to",0.909090909090909
"i am going to",164,"i","am","going","to",0.891304347826087
"going to be a",158,"going","to","be","a",0.211796246648794
"to be able to",156,"to","be","able","to",0.993630573248408
"one of the most",151,"one","of","the","most",0.116243264049269
"i can't wait to",138,"i","can't","wait","to",0.563265306122449
"one of the best",137,"one","of","the","best",0.105465742879138
"i was going to",129,"i","was","going","to",0.848684210526316
"one of my favorite",125,"one","of","my","favorite",0.255623721881391
"i don't want to",122,"i","don't","want","to",0.726190476190476
"i would love to",122,"i","would","love","to",0.772151898734177
"what do you think",118,"what","do","you","think",0.375796178343949
"i would like to",117,"i","would","like","to",0.790540540540541
"hope to see you",112,"hope","to","see","you",0.772413793103448
"a bit of a",110,"a","bit","of","a",0.379310344827586
"for the rest of",102,"for","the","rest","of",0.944444444444444
"the middle of the",102,"the","middle","of","the",0.483412322274882
"i wish i could",101,"i","wish","i","could",0.347079037800687
"have a great weekend",100,"have","a","great","weekend",0.2710027100271
"the top of the",97,"the","top","of","the",0.518716577540107
"to go to the",95,"to","go","to","the",0.221445221445221
"as much as i",94,"as","much","as","i",0.343065693430657
"i want to be",94,"i","want","to","be",0.118686868686869
"have a great day",93,"have","a","great","day",0.252032520325203
"thanks so much for",92,"thanks","so","much","for",0.46
"as well as the",90,"as","well","as","the",0.186721991701245
"i just want to",90,"i","just","want","to",0.642857142857143
"are you going to",88,"are","you","going","to",0.785714285714286
"it's going to be",83,"it's","going","to","be",0.79047619047619
"let me know if",82,"let","me","know","if",0.246246246246246
"on my way to",82,"on","my","way","to",0.602941176470588
"i have no idea",81,"i","have","no","idea",0.373271889400922
"was one of the",81,"was","one","of","the",0.558620689655172
"at the top of",80,"at","the","top","of",0.677966101694915
"i was able to",79,"i","was","able","to",0.9875
"in the first place",79,"in","the","first","place",0.395
"on the other hand",78,"on","the","other","hand",0.423913043478261
"have a lot of",77,"have","a","lot","of",0.777777777777778
"i look forward to",77,"i","look","forward","to",1
"the first time in",77,"the","first","time","in",0.201044386422977
"i thought it was",76,"i","thought","it","was",0.539007092198582
"that awkward moment when",75,"that","awkward","moment","when",0.949367088607595
"will be able to",75,"will","be","able","to",0.986842105263158
"is one of my",73,"is","one","of","my",0.2
"you so much for",73,"you","so","much","for",0.294354838709677
"in front of the",72,"in","front","of","the",0.236065573770492
"a lot of people",71,"a","lot","of","people",0.0633928571428571
"by the end of",71,"by","the","end","of",0.922077922077922
"hope you have a",71,"hope","you","have","a",0.676190476190476
"the back of the",71,"the","back","of","the",0.461038961038961
"for a long time",70,"for","a","long","time",0.760869565217391
"for those of you",68,"for","those","of","you",0.781609195402299
"i don't know what",68,"i","don't","know","what",0.164251207729469
"looking forward to the",68,"looking","forward","to","the",0.103500761035008
"thanks for the ff",68,"thanks","for","the","ff",0.0482269503546099
"had a great time",67,"had","a","great","time",0.320574162679426
"in the united states",67,"in","the","united","states",0.957142857142857
"the best way to",67,"the","best","way","to",0.848101265822785
"going to have to",66,"going","to","have","to",0.488888888888889
"so much for the",66,"so","much","for","the",0.295964125560538
"i feel like i",65,"i","feel","like","i",0.178571428571429
"the bottom of the",65,"the","bottom","of","the",0.619047619047619
"there are so many",65,"there","are","so","many",0.942028985507246
"as soon as i",64,"as","soon","as","i",0.349726775956284
"do you want to",64,"do","you","want","to",0.60952380952381
"if you have a",64,"if","you","have","a",0.205128205128205
"for the most part",63,"for","the","most","part",0.768292682926829
"i have to say",63,"i","have","to","say",0.112299465240642
"the beginning of the",63,"the","beginning","of","the",0.466666666666667
"do you have a",62,"do","you","have","a",0.264957264957265
"thanks for the mention",62,"thanks","for","the","mention",0.0439716312056738
"on the way to",61,"on","the","way","to",0.316062176165803
"a great way to",60,"a","great","way","to",0.857142857142857
"this is one of",60,"this","is","one","of",0.72289156626506
"those of you who",60,"those","of","you","who",0.606060606060606
"to get out of",60,"to","get","out","of",0.48780487804878
"want to go to",60,"want","to","go","to",0.344827586206897
"a little bit of",59,"a","little","bit","of",0.295
"end of the day",59,"end","of","the","day",0.16120218579235
"i don't know if",59,"i","don't","know","if",0.142512077294686
"most of the time",59,"most","of","the","time",0.222641509433962
"i had no idea",58,"i","had","no","idea",0.623655913978495
"the fact that i",58,"the","fact","that","i",0.129464285714286
"what are you doing",58,"what","are","you","doing",0.269767441860465
"a couple of weeks",57,"a","couple","of","weeks",0.11491935483871
"be a part of",57,"be","a","part","of",0.982758620689655
"i really want to",57,"i","really","want","to",0.7125
"the first time i",57,"the","first","time","i",0.148825065274151
"for the shout out",56,"for","the","shout","out",0.875
"i need to get",56,"i","need","to","get",0.107692307692308
"in front of me",56,"in","front","of","me",0.183606557377049
"thank you for your",56,"thank","you","for","your",0.0954003407155026
"thanks for the shout",56,"thanks","for","the","shout",0.0397163120567376
"trying to figure out",56,"trying","to","figure","out",0.835820895522388
"are going to be",55,"are","going","to","be",0.239130434782609
"wait to see you",55,"wait","to","see","you",0.228215767634855
"you have a great",55,"you","have","a","great",0.1375
"hope you had a",54,"hope","you","had","a",0.84375
"i want to go",54,"i","want","to","go",0.0681818181818182
"the rest of my",54,"the","rest","of","my",0.10546875
"this is the first",54,"this","is","the","first",0.136363636363636
"to go back to",54,"to","go","back","to",0.509433962264151
"did you know that",53,"did","you","know","that",0.404580152671756
"for a couple of",53,"for","a","couple","of",0.706666666666667
"i wish i had",53,"i","wish","i","had",0.18213058419244
"in the midst of",53,"in","the","midst","of",0.981481481481482
"know what to do",53,"know","what","to","do",0.552083333333333
"me know if you",53,"me","know","if","you",0.630952380952381
"to get rid of",53,"to","get","rid","of",0.981481481481482
"you don't have to",53,"you","don't","have","to",0.509615384615385
"i don't know how",52,"i","don't","know","how",0.1256038647343
"i dont want to",52,"i","dont","want","to",0.604651162790698
"on the other side",52,"on","the","other","side",0.282608695652174
"if you have any",51,"if","you","have","any",0.163461538461538
"was going to be",51,"was","going","to","be",0.180851063829787
"when i was a",51,"when","i","was","a",0.156441717791411
"can't wait for the",50,"can't","wait","for","the",0.257731958762887
"i love you so",49,"i","love","you","so",0.0862676056338028
"i wish i was",49,"i","wish","i","was",0.168384879725086
"nothing to do with",49,"nothing","to","do","with",0.7
"on top of the",49,"on","top","of","the",0.293413173652695
"take a look at",49,"take","a","look","at",0.590361445783133
"to take care of",49,"to","take","care","of",0.98
"you for the follow",49,"you","for","the","follow",0.227906976744186
"i thought i was",48,"i","thought","i","was",0.317880794701987
"over and over again",48,"over","and","over","again",0.48
"we are going to",48,"we","are","going","to",0.774193548387097
"a few weeks ago",47,"a","few","weeks","ago",0.431192660550459
"am i the only",47,"am","i","the","only",0.903846153846154
"as you can see",47,"as","you","can","see",0.439252336448598
"can i get a",47,"can","i","get","a",0.546511627906977
"in a way that",47,"in","a","way","that",0.534090909090909
"looking forward to seeing",47,"looking","forward","to","seeing",0.0715372907153729
"thank you for following",47,"thank","you","for","following",0.0800681431005111
"the other side of",47,"the","other","side","of",0.479591836734694
"a lot of fun",46,"a","lot","of","fun",0.0410714285714286
"a lot of the",46,"a","lot","of","the",0.0410714285714286
"thank you to all",46,"thank","you","to","all",0.348484848484849
"the name of the",46,"the","name","of","the",0.345864661654135
"you are going to",46,"you","are","going","to",0.779661016949153
"as well as a",45,"as","well","as","a",0.0933609958506224
"hope all is well",45,"hope","all","is","well",0.849056603773585
"i'm going to be",45,"i'm","going","to","be",0.108433734939759
"in the form of",45,"in","the","form","of",0.978260869565217
"to be a good",45,"to","be","a","good",0.0563204005006258
"to get back to",45,"to","get","back","to",0.489130434782609
"would love to see",45,"would","love","to","see",0.154109589041096
"find a way to",44,"find","a","way","to",0.8
"i'm looking forward to",44,"i'm","looking","forward","to",1
"i went to the",44,"i","went","to","the",0.206572769953052
"looking forward to your",44,"looking","forward","to","your",0.0669710806697108
"as a result of",43,"as","a","result","of",0.413461538461538
"as long as you",43,"as","long","as","you",0.190265486725664
"have no idea what",43,"have","no","idea","what",0.32824427480916
"have to go to",43,"have","to","go","to",0.383928571428571
"i'm not going to",43,"i'm","not","going","to",0.895833333333333
"one of the first",43,"one","of","the","first",0.0331023864511162
"the fact that the",43,"the","fact","that","the",0.0959821428571429
"there are a lot",43,"there","are","a","lot",0.352459016393443
"you would like to",43,"you","would","like","to",0.682539682539683
"at the beginning of",42,"at","the","beginning","of",0.75
"i am not a",42,"i","am","not","a",0.146853146853147
"i don't have to",42,"i","don't","have","to",0.227027027027027
"let us know if",42,"let","us","know","if",0.283783783783784
"looking forward to it",42,"looking","forward","to","it",0.0639269406392694
"nice to meet you",42,"nice","to","meet","you",0.893617021276596
"so i decided to",42,"so","i","decided","to",0.777777777777778
"the only one who",42,"the","only","one","who",0.260869565217391
"the rest of us",42,"the","rest","of","us",0.08203125
"thought it would be",42,"thought","it","would","be",0.736842105263158
"i just wanted to",41,"i","just","wanted","to",0.911111111111111
"in the name of",41,"in","the","name","of",0.872340425531915
"it was a good",41,"it","was","a","good",0.0673234811165846
"it was a great",41,"it","was","a","great",0.0673234811165846
"love you so much",41,"love","you","so","much",0.672131147540984
"to get to the",41,"to","get","to","the",0.257861635220126
"to go to sleep",41,"to","go","to","sleep",0.0955710955710956
"you want to be",41,"you","want","to","be",0.0879828326180258
"a lot of time",40,"a","lot","of","time",0.0357142857142857
"and i have a",40,"and","i","have","a",0.172413793103448
"and i have to",40,"and","i","have","to",0.172413793103448
"for a few days",40,"for","a","few","days",0.24390243902439
"i don't know why",40,"i","don't","know","why",0.0966183574879227
"i feel like i'm",40,"i","feel","like","i'm",0.10989010989011
"i want to do",40,"i","want","to","do",0.0505050505050505
"i want you to",40,"i","want","you","to",0.677966101694915
"in the way of",40,"in","the","way","of",0.412371134020619
"is supposed to be",40,"is","supposed","to","be",0.597014925373134
"let me know what",40,"let","me","know","what",0.12012012012012
"on the back of",40,"on","the","back","of",0.470588235294118
"thanks for the retweet",40,"thanks","for","the","retweet",0.0283687943262411
"the only way to",40,"the","only","way","to",0.5
"want to be a",40,"want","to","be","a",0.136518771331058
"you don't want to",40,"you","don't","want","to",0.597014925373134
"at the bottom of",39,"at","the","bottom","of",0.629032258064516
"can't wait to hear",39,"can't","wait","to","hear",0.0767716535433071
"had a lot of",39,"had","a","lot","of",0.8125
"happy mother's day to",39,"happy","mother's","day","to",0.378640776699029
"some of the best",39,"some","of","the","best",0.0706521739130435
"there will be a",39,"there","will","be","a",0.26
"to learn how to",39,"to","learn","how","to",0.928571428571429
"would you like to",39,"would","you","like","to",0.709090909090909
"are a lot of",38,"are","a","lot","of",0.703703703703704
"be one of the",38,"be","one","of","the",0.520547945205479
"do you have any",38,"do","you","have","any",0.162393162393162
"figure out how to",38,"figure","out","how","to",0.791666666666667
"for the sake of",38,"for","the","sake","of",0.974358974358974
"i don't have a",38,"i","don't","have","a",0.205405405405405
"i want to see",38,"i","want","to","see",0.047979797979798
"it would be a",38,"it","would","be","a",0.102702702702703
"may or may not",38,"may","or","may","not",0.95
"my husband and i",38,"my","husband","and","i",0.775510204081633
"over the course of",38,"over","the","course","of",1
"thanks for all the",38,"thanks","for","all","the",0.493506493506494
"you know what i",38,"you","know","what","i",0.233128834355828
"a few years ago",37,"a","few","years","ago",0.366336633663366
"a member of the",37,"a","member","of","the",0.474358974358974
"a part of the",37,"a","part","of","the",0.213872832369942
"all over the world",37,"all","over","the","world",0.293650793650794
"as part of the",37,"as","part","of","the",0.366336633663366
"can't wait to get",37,"can't","wait","to","get",0.0728346456692913
"great to see you",37,"great","to","see","you",0.435294117647059
"had so much fun",37,"had","so","much","fun",0.880952380952381
"i dont know if",37,"i","dont","know","if",0.190721649484536
"i need to go",37,"i","need","to","go",0.0711538461538462
"know what you think",37,"know","what","you","think",0.411111111111111
"thank you very much",37,"thank","you","very","much",0.948717948717949
"to be a part",37,"to","be","a","part",0.0463078848560701
"to be one of",37,"to","be","one","of",0.616666666666667
"to be part of",37,"to","be","part","of",0.948717948717949
"to do with the",37,"to","do","with","the",0.14859437751004
"we look forward to",37,"we","look","forward","to",0.948717948717949
"a look at the",36,"a","look","at","the",0.391304347826087
"all the way to",36,"all","the","way","to",0.204545454545455
"and i want to",36,"and","i","want","to",0.610169491525424
"as one of the",36,"as","one","of","the",0.654545454545455
"forward to seeing you",36,"forward","to","seeing","you",0.418604651162791
"get out of the",36,"get","out","of","the",0.270676691729323
"going to be the",36,"going","to","be","the",0.0482573726541555
"i have to go",36,"i","have","to","go",0.0641711229946524
"i was trying to",36,"i","was","trying","to",0.947368421052632
"i will have to",36,"i","will","have","to",0.378947368421053
"in a long time",36,"in","a","long","time",0.666666666666667
"look forward to seeing",36,"look","forward","to","seeing",0.157894736842105
"makes me want to",36,"makes","me","want","to",0.878048780487805
"no no no no",36,"no","no","no","no",0.610169491525424
"one of the things",36,"one","of","the","things",0.0277136258660508
"thanks to everyone who",36,"thanks","to","everyone","who",0.590163934426229
"that there is a",36,"that","there","is","a",0.295081967213115
"the only thing that",36,"the","only","thing","that",0.288
"this is going to",36,"this","is","going","to",0.818181818181818
"time for me to",36,"time","for","me","to",0.75
"to be in the",36,"to","be","in","the",0.170616113744076
"to be on the",36,"to","be","on","the",0.3
"don't know how to",35,"don't","know","how","to",0.388888888888889
"i don't think i",35,"i","don't","think","i",0.146443514644351
"i have a lot",35,"i","have","a","lot",0.0565428109854604
"if you are a",35,"if","you","are","a",0.0892857142857143
"on the side of",35,"on","the","side","of",0.546875
"other side of the",35,"other","side","of","the",0.729166666666667
"rest of the day",35,"rest","of","the","day",0.11400651465798
"some of the most",35,"some","of","the","most",0.0634057971014493
"thanks for stopping by",35,"thanks","for","stopping","by",0.795454545454545
"the first day of",35,"the","first","day","of",0.660377358490566
"the new york times",35,"the","new","york","times",0.460526315789474
"the way to the",35,"the","way","to","the",0.233333333333333
"this is what i",35,"this","is","what","i",0.2734375
"to check out the",35,"to","check","out","the",0.294117647058824
"to the fact that",35,"to","the","fact","that",0.875
"turned out to be",35,"turned","out","to","be",0.945945945945946
"what to do with",35,"what","to","do","with",0.220125786163522
"you can do it",35,"you","can","do","it",0.284552845528455
"a big fan of",34,"a","big","fan","of",0.755555555555556
"and the rest of",34,"and","the","rest","of",0.708333333333333
"fell in love with",34,"fell","in","love","with",0.693877551020408
"for some reason i",34,"for","some","reason","i",0.295652173913043
"go back to the",34,"go","back","to","the",0.21656050955414
"i can't wait for",34,"i","can't","wait","for",0.138775510204082
"i don't even know",34,"i","don't","even","know",0.34
"i really need to",34,"i","really","need","to",0.53968253968254
"i thought it would",34,"i","thought","it","would",0.24113475177305
"is one of those",34,"is","one","of","those",0.0931506849315069
"it is going to",34,"it","is","going","to",0.918918918918919
"thanks for following me",34,"thanks","for","following","me",0.169154228855721
"thanks for the love",34,"thanks","for","the","love",0.024113475177305
"the last day of",34,"the","last","day","of",0.586206896551724
"there is a lot",34,"there","is","a","lot",0.0734341252699784
"to all of you",34,"to","all","of","you",0.276422764227642
"you dont have to",34,"you","dont","have","to",0.566666666666667
"you please follow me",34,"you","please","follow","me",0.894736842105263
"you want me to",34,"you","want","me","to",0.85
"a couple of days",33,"a","couple","of","days",0.0665322580645161
"from time to time",33,"from","time","to","time",0.970588235294118
"how much i love",33,"how","much","i","love",0.305555555555556
"i cant wait to",33,"i","cant","wait","to",0.507692307692308
"i didn't want to",33,"i","didn't","want","to",0.611111111111111
"i need to be",33,"i","need","to","be",0.0634615384615385
"i the only one",33,"i","the","only","one",0.673469387755102
"if you are interested",33,"if","you","are","interested",0.0841836734693878
"in a couple of",33,"in","a","couple","of",0.589285714285714
"it would have been",33,"it","would","have","been",0.568965517241379
"of the united states",33,"of","the","united","states",0.804878048780488
"once in a while",33,"once","in","a","while",0.717391304347826
"so i had to",33,"so","i","had","to",0.767441860465116
"take the time to",33,"take","the","time","to",0.891891891891892
"thanks for following us",33,"thanks","for","following","us",0.164179104477612
"the end of this",33,"the","end","of","this",0.0550918196994992
"to come up with",33,"to","come","up","with",0.846153846153846
"when i was in",33,"when","i","was","in",0.101226993865031
"and i will be",32,"and","i","will","be",0.206451612903226
"as long as i",32,"as","long","as","i",0.141592920353982
"i think it is",32,"i","think","it","is",0.19047619047619
"i think it was",32,"i","think","it","was",0.19047619047619
"in addition to the",32,"in","addition","to","the",0.326530612244898
"in one of the",32,"in","one","of","the",0.385542168674699
"in the back of",32,"in","the","back","of",0.421052631578947
"in the case of",32,"in","the","case","of",0.727272727272727
"it was time to",32,"it","was","time","to",0.627450980392157
"one of the many",32,"one","of","the","many",0.0246343341031563
"thank you thank you",32,"thank","you","thank","you",1
"that it would be",32,"that","it","would","be",0.551724137931034
"the front of the",32,"the","front","of","the",0.64
"this is a great",32,"this","is","a","great",0.0739030023094688
"to see you there",32,"to","see","you","there",0.082687338501292
"to share with you",32,"to","share","with","you",0.571428571428571
"you have to be",32,"you","have","to","be",0.0831168831168831
"a chance to win",31,"a","chance","to","win",0.174157303370787
"a couple of years",31,"a","couple","of","years",0.0625
"a great deal of",31,"a","great","deal","of",0.508196721311475
"a lot of things",31,"a","lot","of","things",0.0276785714285714
"all of a sudden",31,"all","of","a","sudden",0.939393939393939
"and a lot of",31,"and","a","lot","of",0.775
"and one of the",31,"and","one","of","the",0.563636363636364
"and thank you for",31,"and","thank","you","for",0.418918918918919
"as far as i",31,"as","far","as","i",0.26271186440678
"awkward moment when you",31,"awkward","moment","when","you",0.340659340659341
"back in the day",31,"back","in","the","day",0.186746987951807
"cant wait to see",31,"cant","wait","to","see",0.442857142857143
"had a chance to",31,"had","a","chance","to",0.815789473684211
"he was going to",31,"he","was","going","to",0.885714285714286
"i hope you have",31,"i","hope","you","have",0.124
"i love it when",31,"i","love","it","when",0.158163265306122
"i love you too",31,"i","love","you","too",0.0545774647887324
"in new york city",31,"in","new","york","city",0.227941176470588
"is a good thing",31,"is","a","good","thing",0.186746987951807
"is a lot of",31,"is","a","lot","of",0.492063492063492
"it has been a",31,"it","has","been","a",0.206666666666667
"it was great to",31,"it","was","great","to",0.382716049382716
"not be able to",31,"not","be","able","to",1
"one of the few",31,"one","of","the","few",0.0238645111624326
"please let me know",31,"please","let","me","know",0.861111111111111
"should be able to",31,"should","be","able","to",1
"this is not a",31,"this","is","not","a",0.208053691275168
"to all of our",31,"to","all","of","our",0.252032520325203
"to make sure that",31,"to","make","sure","that",0.209459459459459
"we had a great",31,"we","had","a","great",0.174157303370787
"what is your favorite",31,"what","is","your","favorite",0.36046511627907
"would be a good",31,"would","be","a","good",0.169398907103825
"you had a great",31,"you","had","a","great",0.292452830188679
"you want to do",31,"you","want","to","do",0.0665236051502146
"a few of the",30,"a","few","of","the",0.340909090909091
"a huge fan of",30,"a","huge","fan","of",0.625
"at the university of",30,"at","the","university","of",0.882352941176471
"be part of the",30,"be","part","of","the",0.46875
"come up with a",30,"come","up","with","a",0.232558139534884
"happy mothers day to",30,"happy","mothers","day","to",0.333333333333333
"here are a few",30,"here","are","a","few",0.681818181818182
"i am so excited",30,"i","am","so","excited",0.136363636363636
"i hate when people",30,"i","hate","when","people",0.344827586206897
"in front of a",30,"in","front","of","a",0.0983606557377049
"looking forward to a",30,"looking","forward","to","a",0.045662100456621
"not going to be",30,"not","going","to","be",0.138888888888889
"on a regular basis",30,"on","a","regular","basis",0.909090909090909
"so that i can",30,"so","that","i","can",0.483870967741935
"there is so much",30,"there","is","so","much",0.857142857142857
"to be the best",30,"to","be","the","best",0.0993377483443709
"to figure out how",30,"to","figure","out","how",0.212765957446809
"to keep up with",30,"to","keep","up","with",0.612244897959184
"with the rest of",30,"with","the","rest","of",0.909090909090909
"you have to do",30,"you","have","to","do",0.0779220779220779
"you want to see",30,"you","want","to","see",0.0643776824034335
"don't want to be",29,"don't","want","to","be",0.131221719457014
"every now and then",29,"every","now","and","then",0.763157894736842
"for a chance to",29,"for","a","chance","to",0.878787878787879
"for all of us",29,"for","all","of","us",0.256637168141593
"great to meet you",29,"great","to","meet","you",0.783783783783784
"have a great week",29,"have","a","great","week",0.0785907859078591
"have no idea how",29,"have","no","idea","how",0.221374045801527
"i am trying to",29,"i","am","trying","to",0.805555555555556
"i have a feeling",29,"i","have","a","feeling",0.0468497576736672
"i just had to",29,"i","just","had","to",0.426470588235294
"if you would like",29,"if","you","would","like",0.630434782608696
"in love with the",29,"in","love","with","the",0.146464646464646
"in the near future",29,"in","the","near","future",0.90625
"it is important to",29,"it","is","important","to",0.58
"just got back from",29,"just","got","back","from",0.828571428571429
"me i love you",29,"me","i","love","you",0.617021276595745
"me know what you",29,"me","know","what","you",0.674418604651163
"out of the house",29,"out","of","the","house",0.0500863557858377
"that it was a",29,"that","it","was","a",0.167630057803468
"the only thing i",29,"the","only","thing","i",0.232
