"term","freq","s1","s2","s3","s4","prob"
"at the bar and",5,"at","the","bar","and",0.147058823529412
"at the battle of",5,"at","the","battle","of",1
"at the beginning and",5,"at","the","beginning","and",0.0892857142857143
"at the bus stop",5,"at","the","bus","stop",0.714285714285714
"at the centre of",5,"at","the","centre","of",0.714285714285714
"at the forefront of",5,"at","the","forefront","of",0.625
"at the hard rock",5,"at","the","hard","rock",1
"at the level of",5,"at","the","level","of",0.833333333333333
"at the moment as",5,"at","the","moment","as",0.0396825396825397
"at the new york",5,"at","the","new","york",0.238095238095238
"at the rose garden",5,"at","the","rose","garden",0.833333333333333
"at the time he",5,"at","the","time","he",0.0289017341040462
"at the time it",5,"at","the","time","it",0.0289017341040462
"at the time they",5,"at","the","time","they",0.0289017341040462
"at the world famous",5,"at","the","world","famous",0.333333333333333
"at work so i",5,"at","work","so","i",0.454545454545455
"austin under the mistletoe",5,"austin","under","the","mistletoe",1
"away some of the",5,"away","some","of","the",0.714285714285714
"awesome thanks for sharing",5,"awesome","thanks","for","sharing",0.384615384615385
"awkward moment when a",5,"awkward","moment","when","a",0.0549450549450549
"back and forth and",5,"back","and","forth","and",0.0704225352112676
"back in time to",5,"back","in","time","to",0.208333333333333
"back to the car",5,"back","to","the","car",0.0164473684210526
"back to the drawing",5,"back","to","the","drawing",0.0164473684210526
"back to the grind",5,"back","to","the","grind",0.0164473684210526
"back to the gym",5,"back","to","the","gym",0.0164473684210526
"back to the old",5,"back","to","the","old",0.0164473684210526
"back to the states",5,"back","to","the","states",0.0164473684210526
"back to work and",5,"back","to","work","and",0.0757575757575758
"bake for about minutes",5,"bake","for","about","minutes",1
"be a great day",5,"be","a","great","day",0.0574712643678161
"be a lot more",5,"be","a","lot","more",0.113636363636364
"be able to be",5,"be","able","to","be",0.00920810313075507
"be able to pick",5,"be","able","to","pick",0.00920810313075507
"be able to provide",5,"be","able","to","provide",0.00920810313075507
"be able to start",5,"be","able","to","start",0.00920810313075507
"be able to stay",5,"be","able","to","stay",0.00920810313075507
"be able to understand",5,"be","able","to","understand",0.00920810313075507
"be able to watch",5,"be","able","to","watch",0.00920810313075507
"be afraid of the",5,"be","afraid","of","the",0.5
"be better than the",5,"be","better","than","the",0.208333333333333
"be careful what you",5,"be","careful","what","you",0.625
"be chosen at random",5,"be","chosen","at","random",1
"be compared to the",5,"be","compared","to","the",0.833333333333333
"be found at the",5,"be","found","at","the",0.714285714285714
"be further from the",5,"be","further","from","the",1
"be giving away a",5,"be","giving","away","a",0.625
"be in love with",5,"be","in","love","with",0.555555555555556
"be in new york",5,"be","in","new","york",1
"be looked at as",5,"be","looked","at","as",0.714285714285714
"be nice to your",5,"be","nice","to","your",0.119047619047619
"be part of this",5,"be","part","of","this",0.078125
"be seen in the",5,"be","seen","in","the",0.384615384615385
"be so much fun",5,"be","so","much","fun",0.333333333333333
"be sure to include",5,"be","sure","to","include",0.0276243093922652
"be sure to keep",5,"be","sure","to","keep",0.0276243093922652
"be sure to leave",5,"be","sure","to","leave",0.0276243093922652
"be sure to like",5,"be","sure","to","like",0.0276243093922652
"be taken into account",5,"be","taken","into","account",0.833333333333333
"be the best way",5,"be","the","best","way",0.0526315789473684
"be the guy who",5,"be","the","guy","who",1
"be there for me",5,"be","there","for","me",0.15625
"be there with my",5,"be","there","with","my",0.277777777777778
"be treated like a",5,"be","treated","like","a",0.833333333333333
"bear in mind that",5,"bear","in","mind","that",0.416666666666667
"beautiful day for a",5,"beautiful","day","for","a",0.555555555555556
"because a lot of",5,"because","a","lot","of",1
"because he wanted to",5,"because","he","wanted","to",0.833333333333333
"because it has a",5,"because","it","has","a",0.333333333333333
"because it would be",5,"because","it","would","be",0.454545454545455
"because no one can",5,"because","no","one","can",0.263157894736842
"because of the way",5,"because","of","the","way",0.0303030303030303
"because they are not",5,"because","they","are","not",0.0769230769230769
"because they are the",5,"because","they","are","the",0.0769230769230769
"because you want to",5,"because","you","want","to",1
"bed in the morning",5,"bed","in","the","morning",0.5
"been a bit of",5,"been","a","bit","of",0.25
"been a good day",5,"been","a","good","day",0.227272727272727
"been a great day",5,"been","a","great","day",0.277777777777778
"been a long day",5,"been","a","long","day",0.135135135135135
"been able to see",5,"been","able","to","see",0.0549450549450549
"been around for a",5,"been","around","for","a",0.454545454545455
"been going on for",5,"been","going","on","for",0.277777777777778
"been in love with",5,"been","in","love","with",0.714285714285714
"been on my mind",5,"been","on","my","mind",0.416666666666667
"been one of my",5,"been","one","of","my",0.357142857142857
"been one of the",5,"been","one","of","the",0.357142857142857
"been waiting for a",5,"been","waiting","for","a",0.192307692307692
"been working on this",5,"been","working","on","this",0.113636363636364
"being able to do",5,"being","able","to","do",0.0574712643678161
"being used as a",5,"being","used","as","a",0.555555555555556
"believe that i am",5,"believe","that","i","am",0.277777777777778
"best bet is to",5,"best","bet","is","to",0.833333333333333
"best feeling in the",5,"best","feeling","in","the",1
"best friend in the",5,"best","friend","in","the",0.833333333333333
"best in the world",5,"best","in","the","world",0.277777777777778
"best things in life",5,"best","things","in","life",0.714285714285714
"better than anyone else",5,"better","than","anyone","else",0.833333333333333
"better than i do",5,"better","than","i","do",0.217391304347826
"between am and pm",5,"between","am","and","pm",0.714285714285714
"between you and the",5,"between","you","and","the",0.357142857142857
"bigger and better things",5,"bigger","and","better","things",0.5
"birthday i love you",5,"birthday","i","love","you",0.833333333333333
"birthday to her please",5,"birthday","to","her","please",0.833333333333333
"birthday to you happy",5,"birthday","to","you","happy",0.333333333333333
"bit of a surprise",5,"bit","of","a","surprise",0.040650406504065
"bored out of my",5,"bored","out","of","my",1
"boston add boston add",5,"boston","add","boston","add",0.833333333333333
"bottom of this post",5,"bottom","of","this","post",0.714285714285714
"burned calories doing minutes",5,"burned","calories","doing","minutes",1
"but as soon as",5,"but","as","soon","as",1
"but at least we",5,"but","at","least","we",0.0925925925925926
"but at least you",5,"but","at","least","you",0.0925925925925926
"but every now and",5,"but","every","now","and",0.833333333333333
"but for now i",5,"but","for","now","i",0.2
"but here's my number",5,"but","here's","my","number",0.625
"but here we are",5,"but","here","we","are",1
"but i am so",5,"but","i","am","so",0.034965034965035
"but i believe that",5,"but","i","believe","that",0.3125
"but i decided to",5,"but","i","decided","to",0.5
"but i did it",5,"but","i","did","it",0.087719298245614
"but i don't see",5,"but","i","don't","see",0.0446428571428571
"but i find it",5,"but","i","find","it",0.3125
"but i have the",5,"but","i","have","the",0.032258064516129
"but i knew that",5,"but","i","knew","that",0.3125
"but i know that",5,"but","i","know","that",0.0735294117647059
"but i know the",5,"but","i","know","the",0.0735294117647059
"but i know you",5,"but","i","know","you",0.0735294117647059
"but i like it",5,"but","i","like","it",0.147058823529412
"but i still like",5,"but","i","still","like",0.0714285714285714
"but i still love",5,"but","i","still","love",0.0714285714285714
"but i thought i",5,"but","i","thought","i",0.192307692307692
"but i wonder if",5,"but","i","wonder","if",0.555555555555556
"but i would have",5,"but","i","would","have",0.151515151515152
"but it does seem",5,"but","it","does","seem",0.192307692307692
"but it has a",5,"but","it","has","a",0.217391304347826
"but it has been",5,"but","it","has","been",0.217391304347826
"but it is still",5,"but","it","is","still",0.0284090909090909
"but it seems like",5,"but","it","seems","like",0.227272727272727
"but it turns out",5,"but","it","turns","out",1
"but it was too",5,"but","it","was","too",0.0297619047619048
"but its not the",5,"but","its","not","the",0.208333333333333
"but most of the",5,"but","most","of","the",0.294117647058824
"but not as much",5,"but","not","as","much",0.227272727272727
"but not enough to",5,"but","not","enough","to",0.625
"but not quite as",5,"but","not","quite","as",0.416666666666667
"but now i have",5,"but","now","i","have",0.131578947368421
"but on the other",5,"but","on","the","other",0.238095238095238
"but that's another story",5,"but","that's","another","story",0.714285714285714
"but that is a",5,"but","that","is","a",0.116279069767442
"but that is what",5,"but","that","is","what",0.116279069767442
"but the fact is",5,"but","the","fact","is",0.294117647058824
"but the point is",5,"but","the","point","is",1
"but there are plenty",5,"but","there","are","plenty",0.0757575757575758
"but there was a",5,"but","there","was","a",0.151515151515152
"but this is one",5,"but","this","is","one",0.0568181818181818
"but we all know",5,"but","we","all","know",0.25
"but you are not",5,"but","you","are","not",0.384615384615385
"but you can also",5,"but","you","can","also",0.0909090909090909
"but you never know",5,"but","you","never","know",0.454545454545455
"by a couple of",5,"by","a","couple","of",1
"by clicking on the",5,"by","clicking","on","the",0.714285714285714
"by that i mean",5,"by","that","i","mean",0.555555555555556
"by the lack of",5,"by","the","lack","of",1
"by the time they",5,"by","the","time","they",0.0510204081632653
"by visit the link",5,"by","visit","the","link",1
"call it a day",5,"call","it","a","day",0.147058823529412
"calories doing minutes of",5,"calories","doing","minutes","of",1
"came home to find",5,"came","home","to","find",0.454545454545455
"came in with a",5,"came","in","with","a",0.5
"came out of a",5,"came","out","of","a",0.147058823529412
"can't think of anything",5,"can't","think","of","anything",0.227272727272727
"can't wait for it",5,"can't","wait","for","it",0.0257731958762887
"can't wait for more",5,"can't","wait","for","more",0.0257731958762887
"can't wait to catch",5,"can't","wait","to","catch",0.00984251968503937
"can't wait to work",5,"can't","wait","to","work",0.00984251968503937
"can be hard to",5,"can","be","hard","to",0.625
"can be made in",5,"can","be","made","in",0.227272727272727
"can be used for",5,"can","be","used","for",0.135135135135135
"can be used in",5,"can","be","used","in",0.135135135135135
"can change the world",5,"can","change","the","world",0.5
"can do for you",5,"can","do","for","you",0.3125
"can give you a",5,"can","give","you","a",0.227272727272727
"can i ask you",5,"can","i","ask","you",0.625
"can i say i",5,"can","i","say","i",0.147058823529412
"can make all the",5,"can","make","all","the",1
"can make it work",5,"can","make","it","work",0.125
"can see from the",5,"can","see","from","the",0.833333333333333
"can take care of",5,"can","take","care","of",1
"can tell you how",5,"can","tell","you","how",0.161290322580645
"can think about is",5,"can","think","about","is",0.714285714285714
"can you dm me",5,"can","you","dm","me",0.625
"can you see the",5,"can","you","see","the",0.294117647058824
"cannot come fast enough",5,"cannot","come","fast","enough",1
"cant wait to hear",5,"cant","wait","to","hear",0.0714285714285714
"caprera hotel venice italy",5,"caprera","hotel","venice","italy",1
"card i made for",5,"card","i","made","for",0.416666666666667
"card i used the",5,"card","i","used","the",0.833333333333333
"care in the world",5,"care","in","the","world",1
"careful what you wish",5,"careful","what","you","wish",0.714285714285714
"case by case basis",5,"case","by","case","basis",0.833333333333333
"catch a glimpse of",5,"catch","a","glimpse","of",1
"catch up on some",5,"catch","up","on","some",0.147058823529412
"catch up on the",5,"catch","up","on","the",0.147058823529412
"catching up to do",5,"catching","up","to","do",0.833333333333333
"check it out if",5,"check","it","out","if",0.0256410256410256
"check out my new",5,"check","out","my","new",0.0925925925925926
"check out some of",5,"check","out","some","of",0.333333333333333
"click here to read",5,"click","here","to","read",0.416666666666667
"close to my heart",5,"close","to","my","heart",0.357142857142857
"come check out our",5,"come","check","out","our",0.333333333333333
"come down to the",5,"come","down","to","the",0.227272727272727
"come in the form",5,"come","in","the","form",0.294117647058824
"come into contact with",5,"come","into","contact","with",1
"come out at night",5,"come","out","at","night",0.833333333333333
"come out of my",5,"come","out","of","my",0.1
"come to grips with",5,"come","to","grips","with",1
"come to those who",5,"come","to","those","who",1
"come up to me",5,"come","up","to","me",0.454545454545455
"comes to mind is",5,"comes","to","mind","is",0.227272727272727
"coming out last night",5,"coming","out","last","night",0.833333333333333
"coming soon stay tuned",5,"coming","soon","stay","tuned",1
"coming up with a",5,"coming","up","with","a",0.227272727272727
"compared to the rest",5,"compared","to","the","rest",0.121951219512195
"congrats on your new",5,"congrats","on","your","new",0.178571428571429
"considered to be a",5,"considered","to","be","a",0.277777777777778
"contrary to popular belief",5,"contrary","to","popular","belief",1
"cool to room temperature",5,"cool","to","room","temperature",1
"could be seen as",5,"could","be","seen","as",0.714285714285714
"could care less about",5,"could","care","less","about",0.357142857142857
"could go back to",5,"could","go","back","to",0.454545454545455
"could have been the",5,"could","have","been","the",0.078125
"couple of days after",5,"couple","of","days","after",0.0961538461538462
"couple of weeks now",5,"couple","of","weeks","now",0.0617283950617284
"cups of coffee and",5,"cups","of","coffee","and",0.5
"d i love you",5,"d","i","love","you",0.714285714285714
"damage attacks up to",5,"damage","attacks","up","to",1
"day in a row",5,"day","in","a","row",0.454545454545455
"day in and day",5,"day","in","and","day",0.714285714285714
"day in the life",5,"day","in","the","life",0.0806451612903226
"day in the neighborhood",5,"day","in","the","neighborhood",0.0806451612903226
"day of i am",5,"day","of","i","am",0.833333333333333
"day thanks for the",5,"day","thanks","for","the",0.833333333333333
"day to all my",5,"day","to","all","my",0.0943396226415094
"day to be over",5,"day","to","be","over",0.3125
"day to day life",5,"day","to","day","life",0.151515151515152
"day when i was",5,"day","when","i","was",0.454545454545455
"decided that i am",5,"decided","that","i","am",0.192307692307692
"did i mention i",5,"did","i","mention","i",0.121951219512195
"did it in a",5,"did","it","in","a",0.416666666666667
"did not get to",5,"did","not","get","to",0.333333333333333
"did not have a",5,"did","not","have","a",0.119047619047619
"did not have to",5,"did","not","have","to",0.119047619047619
"did not know what",5,"did","not","know","what",0.128205128205128
"did u get my",5,"did","u","get","my",0.294117647058824
"did you end up",5,"did","you","end","up",1
"did you get to",5,"did","you","get","to",0.0595238095238095
"did you know you",5,"did","you","know","you",0.0381679389312977
"did you make it",5,"did","you","make","it",0.333333333333333
"didn't get a chance",5,"didn't","get","a","chance",0.333333333333333
"didn't think it was",5,"didn't","think","it","was",0.714285714285714
"didn't want her to",5,"didn't","want","her","to",0.833333333333333
"didn't want to leave",5,"didn't","want","to","leave",0.0746268656716418
"didnt have time to",5,"didnt","have","time","to",0.833333333333333
"didnt know what to",5,"didnt","know","what","to",0.384615384615385
"didnt want her to",5,"didnt","want","her","to",1
"do a barrel roll",5,"do","a","barrel","roll",1
"do all sorts of",5,"do","all","sorts","of",1
"do anything for you",5,"do","anything","for","you",0.384615384615385
"do in the morning",5,"do","in","the","morning",0.178571428571429
"do it all the",5,"do","it","all","the",0.217391304347826
"do it for me",5,"do","it","for","me",0.138888888888889
"do let me know",5,"do","let","me","know",1
"do not appear to",5,"do","not","appear","to",1
"do not be afraid",5,"do","not","be","afraid",0.333333333333333
"do not like the",5,"do","not","like","the",0.263157894736842
"do say so myself",5,"do","say","so","myself",0.833333333333333
"do some of the",5,"do","some","of","the",0.833333333333333
"do the same with",5,"do","the","same","with",0.0595238095238095
"do this to me",5,"do","this","to","me",0.416666666666667
"do u have a",5,"do","u","have","a",0.238095238095238
"do u have any",5,"do","u","have","any",0.238095238095238
"do what i can",5,"do","what","i","can",0.166666666666667
"do what is right",5,"do","what","is","right",0.5
"do what they want",5,"do","what","they","want",0.454545454545455
"do what you want",5,"do","what","you","want",0.172413793103448
"do whats best for",5,"do","whats","best","for",1
"do you have anything",5,"do","you","have","anything",0.0213675213675214
"do you have the",5,"do","you","have","the",0.0213675213675214
"do you love me",5,"do","you","love","me",0.208333333333333
"do you need a",5,"do","you","need","a",0.135135135135135
"do yourself a favor",5,"do","yourself","a","favor",1
"does anyone else think",5,"does","anyone","else","think",0.333333333333333
"does anyone have a",5,"does","anyone","have","a",0.333333333333333
"does anyone know how",5,"does","anyone","know","how",0.172413793103448
"does it look like",5,"does","it","look","like",0.833333333333333
"does not mean you",5,"does","not","mean","you",0.15625
"doesn't want to be",5,"doesn't","want","to","be",0.238095238095238
"don't care who you",5,"don't","care","who","you",0.5
"don't even have to",5,"don't","even","have","to",0.416666666666667
"don't even know if",5,"don't","even","know","if",0.0925925925925926
"don't even need to",5,"don't","even","need","to",0.714285714285714
"don't have time for",5,"don't","have","time","for",0.227272727272727
"don't have to do",5,"don't","have","to","do",0.037593984962406
"don't know about the",5,"don't","know","about","the",0.166666666666667
"don't know how you",5,"don't","know","how","you",0.0555555555555556
"don't know the key",5,"don't","know","the","key",0.238095238095238
"don't know where to",5,"don't","know","where","to",0.217391304347826
"don't really know what",5,"don't","really","know","what",0.384615384615385
"don't think i could",5,"don't","think","i","could",0.121951219512195
"don't think i have",5,"don't","think","i","have",0.121951219512195
"don't want to say",5,"don't","want","to","say",0.0226244343891403
"done a better job",5,"done","a","better","job",1
"done in my life",5,"done","in","my","life",0.714285714285714
"dont have to like",5,"dont","have","to","like",0.0769230769230769
"dont know what is",5,"dont","know","what","is",0.0909090909090909
"dont want to have",5,"dont","want","to","have",0.0393700787401575
"down the road from",5,"down","the","road","from",0.119047619047619
"down the sides of",5,"down","the","sides","of",0.714285714285714
"during the civil war",5,"during","the","civil","war",0.833333333333333
"during the course of",5,"during","the","course","of",1
"during the summer months",5,"during","the","summer","months",0.25
"e t w e",5,"e","t","w","e",1
"each other in a",5,"each","other","in","a",0.172413793103448
"earlier in the day",5,"earlier","in","the","day",0.227272727272727
"early in the season",5,"early","in","the","season",0.119047619047619
"easy to use and",5,"easy","to","use","and",0.416666666666667
"end of the tunnel",5,"end","of","the","tunnel",0.0136612021857923
"end of this post",5,"end","of","this","post",0.147058823529412
"ended up in the",5,"ended","up","in","the",0.294117647058824
"ended up with a",5,"ended","up","with","a",0.263157894736842
"ends of the earth",5,"ends","of","the","earth",0.333333333333333
"enough to have a",5,"enough","to","have","a",0.217391304347826
"entered to win a",5,"entered","to","win","a",0.5
"even a little bit",5,"even","a","little","bit",0.384615384615385
"even if i don't",5,"even","if","i","don't",0.113636363636364
"even if i dont",5,"even","if","i","dont",0.113636363636364
"even if you are",5,"even","if","you","are",0.0806451612903226
"even though i'm not",5,"even","though","i'm","not",0.357142857142857
"even though they are",5,"even","though","they","are",0.25
"ever happened to me",5,"ever","happened","to","me",0.454545454545455
"every minute of it",5,"every","minute","of","it",0.454545454545455
"everyone for all the",5,"everyone","for","all","the",0.625
"everyone have a great",5,"everyone","have","a","great",0.294117647058824
"everyone is talking about",5,"everyone","is","talking","about",0.833333333333333
"everything to do with",5,"everything","to","do","with",0.833333333333333
"exactly how i feel",5,"exactly","how","i","feel",0.454545454545455
"exactly the same way",5,"exactly","the","same","way",0.2
"exactly what it is",5,"exactly","what","it","is",0.5
"excited to go to",5,"excited","to","go","to",0.333333333333333
"excited to see my",5,"excited","to","see","my",0.078125
"excited to see the",5,"excited","to","see","the",0.078125
"fact that he had",5,"fact","that","he","had",0.178571428571429
"failure is trying to",5,"failure","is","trying","to",1
"famous comic strip live",5,"famous","comic","strip","live",1
"fathers day to all",5,"fathers","day","to","all",1
"feel like going to",5,"feel","like","going","to",0.555555555555556
"feel like they are",5,"feel","like","they","are",0.277777777777778
"feel so much better",5,"feel","so","much","better",0.714285714285714
"feel sorry for him",5,"feel","sorry","for","him",0.238095238095238
"felt as if i",5,"felt","as","if","i",0.555555555555556
"felt like it was",5,"felt","like","it","was",0.277777777777778
"few days ago i",5,"few","days","ago","i",0.263157894736842
"finally getting around to",5,"finally","getting","around","to",1
"find a lot of",5,"find","a","lot","of",1
"find out about the",5,"find","out","about","the",0.416666666666667
"find out what happens",5,"find","out","what","happens",0.108695652173913
"first half of the",5,"first","half","of","the",0.555555555555556
"first i want to",5,"first","i","want","to",0.833333333333333
"first round of the",5,"first","round","of","the",0.416666666666667
"first time i have",5,"first","time","i","have",0.0746268656716418
"first time i went",5,"first","time","i","went",0.0746268656716418
"first time in my",5,"first","time","in","my",0.0568181818181818
"five years ago i",5,"five","years","ago","i",0.294117647058824
"follow me and i'll",5,"follow","me","and","i'll",0.142857142857143
"follow me back i",5,"follow","me","back","i",0.0833333333333333
"follow me i will",5,"follow","me","i","will",0.0769230769230769
"follow me please i",5,"follow","me","please","i",0.078125
"follow my new twitter",5,"follow","my","new","twitter",0.25
"follow my other account",5,"follow","my","other","account",1
"follow would love to",5,"follow","would","love","to",1
"following poised creation on",5,"following","poised","creation","on",1
"following the hilltop on",5,"following","the","hilltop","on",1
"following us on twitter",5,"following","us","on","twitter",0.833333333333333
"for a bit and",5,"for","a","bit","and",0.0909090909090909
"for a brand new",5,"for","a","brand","new",0.833333333333333
"for a day or",5,"for","a","day","or",0.142857142857143
"for a few moments",5,"for","a","few","moments",0.0304878048780488
"for a great night",5,"for","a","great","night",0.0684931506849315
"for a great season",5,"for","a","great","season",0.0684931506849315
"for a moment the",5,"for","a","moment","the",0.108695652173913
"for a new job",5,"for","a","new","job",0.0537634408602151
"for a reason and",5,"for","a","reason","and",0.102040816326531
"for a while so",5,"for","a","while","so",0.0271739130434783
"for a while to",5,"for","a","while","to",0.0271739130434783
"for a year and",5,"for","a","year","and",0.1
"for about minutes or",5,"for","about","minutes","or",0.131578947368421
"for all i know",5,"for","all","i","know",0.714285714285714
"for all of my",5,"for","all","of","my",0.0442477876106195
"for all of our",5,"for","all","of","our",0.0442477876106195
"for all that you",5,"for","all","that","you",0.294117647058824
"for all the love",5,"for","all","the","love",0.0364963503649635
"for an hour and",5,"for","an","hour","and",0.119047619047619
"for at least a",5,"for","at","least","a",0.0925925925925926
"for at least minutes",5,"for","at","least","minutes",0.0925925925925926
"for at least two",5,"for","at","least","two",0.0925925925925926
"for both of us",5,"for","both","of","us",0.357142857142857
"for example if you",5,"for","example","if","you",0.454545454545455
"for following me on",5,"for","following","me","on",0.0847457627118644
"for following the hilltop",5,"for","following","the","hilltop",0.833333333333333
"for following us on",5,"for","following","us","on",0.119047619047619
"for following us we",5,"for","following","us","we",0.119047619047619
"for god did not",5,"for","god","did","not",1
"for inviting me to",5,"for","inviting","me","to",0.625
"for less than a",5,"for","less","than","a",0.384615384615385
